release_date,developer,publisher,userscore,rating,summary,metascore,genres,title
"Jan 24, 2017",Square Enix,Square Enix,8.2,E10+,"KINGDOM HEARTS HD 2.8 Final Chapter Prologue is a compilation of 3 magical KINGDOM HEARTS experiences: Originally released in 2012, KINGDOM HEARTS Dream Drop Distance HD is a full-HD remastered version of KINGDOM HEARTS 3D Dream Drop Distance, brought to console for the first time. Series protagonists Sora and Riku take on the Mark of Mastery exam in preparation for coming threats. The signature action of the KINGDOM HEARTS series has evolved, allowing players to experience faster-paced battles and exploration at a blistering pace. KINGDOM HEARTS χ Back Cover (movie) A new HD movie that tells the mysterious story of the Foretellers, connecting the earliest parts of the series’ history, showcased in the mobile title KINGDOM HEARTS Unchained χ. KINGDOM HEARTS 0.2 Birth by Sleep – A Fragmentary Passage – A completely new playable episode that links to the story of KINGDOM HEARTS III, taking place after the storyline of KINGDOM HEARTS Birth by Sleep played from the perspective of Aqua. [Square-Enix]",76,Miscellaneous|Compilation|Role-Playing|Action RPG|,Kingdom Hearts HD 2.8 Final Chapter Prologue
"Sep  9, 2014",Bungie Software,Activision,6.1,T,"In Destiny (from the creators of Halo) you are a Guardian of the last city on Earth. You are able to wield incredible power. Explore the ancient ruins of our solar system, from the vast dunes of Mars to the lush jungles of Venus. Defeat Earth’s enemies. Reclaim all that we have lost. Become legend. Embark on an epic action adventure with rich cinematic storytelling where you unravel the mysteries of our universe and reclaim what we lost at the fall of our Golden Age. The next evolution of the first-person action genre that promises to provide an unprecedented combination of storytelling, cooperative, competitive, and public gameplay, and personal activities that are all woven into an expansive, persistent online world. Venture out alone or join up with friends. The choice is yours. Personalize and upgrade every aspect of how you look and fight with a nearly limitless combination of armor, weapons, and visual customizations. Take your upgraded character into every mode, including campaign, cooperative, social, public, and competitive multiplayer.",76,Shooter|Sci-Fi|Action|Shooter|First-Person|Sci-Fi|Arcade|,Destiny
"Oct  5, 2018",Yuke's,2K Games,6.1,T,"WWE 2K19 arrives as the latest entry to the flagship WWE video game franchise and features cover Superstar AJ Styles. WWE 2K19 will showcase a massive roster of popular WWE Superstars, Legends and Hall of Famers, as well as NXT favorites. Experience authentic WWE gameplay, extensive creation options, engaging match types, fan-favorite modes and much more!",76,Sports|Individual|Combat|Wrestling|,WWE 2K19
"Dec  9, 2020",2 Ton Studios,Big Sugar Films,5.0,None,Great game! But I think it would be better on an app. Seems like a tier 1 app game. I love it but wish I could play it on my phone or tablet. Love the dark creeping along in the dark even with a torch. Which you of course drop when you enter battle.,76,Action Adventure|General|,Unto The End
"Jan 29, 2021",Gauntlet Games,Crunching Koalas,tbd,None,None,76,Action|Miscellaneous|General|Party / Minigame|,Bonkies
"Jun  5, 2018",Arc System Works,Arc System Works,6.6,T,"<span class=""blurb blurb_collapsed"">THE COLLISION IS INEVITABLE! THE IMPACT WILL BE UNAVOIDABLE!<br/>An unrivaled clash of explosive proportions! The beloved BlazBlue franchise Crosses universes, Tags in fan favorites, and Battles it out in BlazBlue: Cross Tag Battle! Created through an all-star collaboration between BlazBlue,</span>",76,Action|Fighting|2D|,BlazBlue: Cross Tag Battle
"Jun  6, 2019",Milestone S.r.l,Milestone S.r.l,7.5,E,"This game is really good compared with other bike's videogames market offers. It is plenty of new features and the overall feeling is very positive about new physics, gameplay and graphics.",76,Racing|Simulation|Automobile|,MotoGP 19
"Apr 25, 2017",Omega Force,Square Enix,7.6,T,"Take the idea of turn based DQ8, put it in a modern format with action elements. Allow to fight against many enemies at the same time. But keep the idea behind everything, tell a story. Yuji Horii does it with DQH2. A perfect game, but maybe, too easy in the beginning. Fun, anyway.",76,Action|Beat-'Em-Up|3D|,Dragon Quest Heroes II
"Feb 19, 2019",Henchman & Goon,Henchman & Goon,4.3,E,"<span class=""blurb blurb_collapsed"">Pode<br/>an adorable journey home<br/>Pode is a coop puzzle platforming game where you play as  a rock and a star, as you try and climb a mountain</span>",76,Adventure|3D|Third-Person|,Pode
"Apr 23, 2020",Milestone S.r.l,Deep Silver,7.3,E,"Take control of your own career, switch from real teams to new teams created with sponsors from the world of MotoGP™, decide the development of the bike and manage your technical unit to win. Improved physics, with even more realistic and complex braking management. The tire has been divided into independent sectors for wear and temperature, and the fuel consumption can be managed with driving style and power maps. If you were looking for a challenge, this is definitely the one for you. Being a successful driver is much more than just keeping the throttle wide open. You also need to win with style! Unleash your creativity with 6 different graphic editors, including the new Suit and Livery editor for your bike. [Milestone]",76,Racing|Simulation|Arcade|Automobile|,MotoGP 20
"Apr 24, 2020",Square Enix,Square Enix,7.5,T,"When the world was shrouded in darkness, the Goddess of Mana drew forth the Sword of Mana to smite the eight Benevodons, monsters of destruction. She sealed the horrors inside the eight Mana Stones, bringing the realm back from the brink. Weakened from rebuilding the world, the Goddess changed herself into a tree and fell into a deep sleep for many years. However, the forces of evil soon sought to free the Benevodons to gain control of the world. They started a terrible war to further their plot and destabilize the kingdoms. Peace was at an end. Mana itself began to disappear from the world and the Mana Tree started to wither...",76,Role-Playing|Action RPG|,Trials of Mana
"Jul 21, 2015",Toxic Games,Toxic Games,6.8,T,Excellent game. The story is your an astronaut in a cube in space and your trying to solve these puzzles to save earth and you got two people inside your helmet telling you what to do. one telling you to go through with the puzzles and the other one telling you its all a lie and that  your being tested and should stop solving the puzzles. The first person telling you that the other voice is in your head and that your going mad due to the isolation in space and that you need to solve the puzzles asap. The gameplay is great solving puzzles in a room and then moving on to the next one. There is a secret room in which you can solve a rubiks cube which is hard. These puzzles are really taxing but great fun. If your a fan of the portal's then pick this up because its very good,76,Puzzle|Logic|,Q.U.B.E. Director's Cut
"Feb 28, 2017",InXile Entertainment,Techland,6.9,M,"Torment: Tides of Numenera is a single-player role-playing game which continues the thematic legacy of the critically acclaimed Planescape: Torment by having to face complex and nuanced morality decisions, carefully contemplating deep and reactive choices with consequences that echo throughout the game all the while immersed into a new and strange vision taken from by renowned designer and writer Monte Cook's new tabletop role-playing game, Numenera. In Torment: Tides of Numenera, players must decide for themselves the answer to the eternal question, what does one life matter? Numenera's Ninth World is a fantastic vision of a world in which massive civilizations continue to rise and fall with only cities, monuments, and artifacts left behind to serve as reminders of their past existence. These reminders have become part of the accumulated detritus of eons and now this assortment of ancient power, called the numenera, is there for the taking. One of these humans has discovered a way to harness the numenera to grow strong, to cheat death, to skip across the face of centuries in a succession of bodies. But he discovers an unexpected side effect: You.",76,General|Role-Playing|Western-Style|,Torment: Tides of Numenera
"Oct 20, 2020",id Software,Bethesda Softworks,6.7,None,"The fight's not over! Your victory over the hordes of Hell spared Earth from a perilous, demon-infested fate, but saving humanity has upset the delicate balance of power in the heavens. Become the DOOM Slayer once again and set things right in DOOM Eternal's first single-player expansion,",76,Action|Shooter|First-Person|Arcade|,DOOM Eternal: The Ancient Gods Part One
"Apr 11, 2017",Zeboyd Games,Zeboyd Games,7.5,T,"The game has bugs, and glitches, yes, it's also not polished, least not as much as it should be. That said, it's not a cash-in, it's a",76,Console-style RPG|Console-style RPG|Role-Playing|Japanese-Style|,Cosmic Star Heroine
"Feb  3, 2015",Alientrap,Alientrap,7.3,T,"The Gods of Olympus have abandoned humans, leaving them to perish without their benevolence. Take up arms against the Gods, climb Mount Olympus, and assume their divine powers for yourself to ensure the human race’s survival. Apotheon is a 2D action game with a heroic narrative based on Ancient Greek Mythology.",76,Action|Beat-'Em-Up|2D|,Apotheon
"Aug 21, 2020",HB Studios Multimedia,2K Games,6.4,E,"<span class=""blurb blurb_collapsed"">ALL-NEW PGA TOUR CAREER MODE:Prove you’ve got what it takes to become FedExCup Champion. Take on PGA TOUR Pros during your very own career, earning rewards and gear along the way.<br/>  PGA TOUR PROS AND NEW COURSES: Play against Justin Thomas and 11 top pros on stunning, real-life courses</span>",76,Sports|Individual|Golf|Sim|,PGA Tour 2K21
"Sep 30, 2014",Frima Studio,Frima Studio,7.0,E,"<span class=""blurb blurb_collapsed"">Chariot is a humoristic physics-based couch co-op platformer in which a brave princess and her suitor carry a funeral wagon through ancient caves,  fending-off swarms of looters while amassing riches, to bury the King's remains in a worthy gold-filled tomb. <br/><br/>If only that dead King would</span>",76,Action|Platformer|2D|,Chariot
"Oct 27, 2020",ONE MORE LEVEL,All in! Games,7.2,M,"Ghostrunner is a hardcore FPP slasher packed with lightning-fast action, set in a grim, cyberpunk megastructure. Climb Dharma Tower, humanity’s last shelter, after a world-ending cataclysm. Make your way up from the bottom to the top, confront the tyrannical Keymaster, and take your revenge. The streets of this tower city are full of violence. Mara the Keymaster rules with an iron fist and little regard for human life. As resources diminish, the strong prey on the weak and chaos threatens to consume what little order remains. The decisive last stand is coming. A final attempt to set things right before mankind goes over the edge of extinction. As the most advanced blade fighter ever created, you’re always outnumbered but never outclassed. Slice your enemies with a monomolecular katana, dodge bullets with your superhuman reflexes, and employ a variety of specialized techniques to prevail. One-hit one-kill mechanics make combat fast and intense. Use your superior mobility (and frequent checkpoints!) to engage in a never-ending dance with death fearlessly. Ghostrunner offers a unique single-player experience: fast-paced, violent combat, and an original setting that blends science fiction with post-apocalyptic themes. It tells the story of a world that has already ended and its inhabitants who fight to survive.",76,Action|Adventure|General|Platformer|3D|,Ghostrunner
"Mar 13, 2018",Toxic Games,Toxic Games,7.1,T,"Assume the role of Amelia Cross, a stranded archaeologist who has mysteriously awaken among the sand swept ruins of an ancient alien landscape. Together with the distant help of another survivor, Commander Emma Sutcliffe, you must traverse and manipulate the structure of this forgotten world to find a way back home.",76,Sci-Fi|Action|Shooter|First-Person|Arcade|,Q.U.B.E. 2
"Jan 17, 2017",MidBoss,MidBoss,3.4,M,"Neo-San Francisco, 2064 AD. Your life as a struggling journalist is interrupted by the world’s first sapient machine, a ROM (Relationship and Organizational Manager) named Turing. Together, you and the quirky robot will encounter a colorful cast of locals and overcome challenges as you uncover the city’s secrets behind the overlapping futures of technology and humanity. Can you survive in Neo-SF? Or will the mystery go unsolved?",76,General|Adventure|Point-and-Click|,2064: Read Only Memories
"Jun  9, 2021",Creepy Jar,Creepy Jar,7.7,None,"<span class=""blurb blurb_collapsed"">GREEN HELL is an Open World Survival Simulator set in the uncharted unique setting of the Amazonian rainforest.<br/> <br/>You are left alone in the jungle without any food or equipment, trying to survive and find your way out. Clinging to life, the player is set on a journey of durability as the</span>",76,Action Adventure|Survival|,Green Hell
"Jul 15, 2021",DANGEN Entertainment,DANGEN Entertainment,tbd,None,"<span class=""blurb blurb_collapsed"">Sometimes fighting malevolence requires brave souls and a bunch of smelly fruit.<br/><br/>Batbarian: Testament of the Primordials is a snarky action-adventure puzzle game with a good dose of humor. Explore hundreds of secret-filled rooms, fight big bosses, gather companions for your party and use</span>",76,Action Adventure|General|,Batbarian: Testament of the Primordials
"Oct 25, 2016",Secret Sorcery,Secret Sorcery,7.4,E10+,"Wow. When will they add some more of the highly positive critic reviews that are out there? Honestly, this game is a blast. Probably my",76,Action|Strategy|General|,Tethered
"Feb 21, 2017",Chilled Mouse,Chilled Mouse,2.9,E,"<span class=""blurb blurb_collapsed"">Chime Sharp<br/>A game with just as much potential as it has problems…<br/>Chime sharp is a music meats Tetris styled puzzle game...
The concept is</span>",76,Puzzle|General|,Chime Sharp
"Sep 27, 2019",Limbic Entertainment,Kalypso,6.7,T,I am giving this a 10 solely based on the amazing jump in the quality of the graphics between Tropico 5 and Tropico 6. I've been playing games,76,Strategy|Management|Government|,Tropico 6
"Jul  8, 2021",Rebellion,Rebellion,5.6,None,"It was good at first, but then I started to have issues with taking cover, I was getting shot anyway even though ai crouched and it just set me back to standing with or without the crouch button. I could not move without getting shot at, the graphics are **** enough so that you cant see an enemy some meters away and you would expect way better graphics for a Tripple A game(game made by a bigtime company). I got stuck on ”recalibrate” endlessly even though my VR is working properly. So I just quit the game. Deleted it. And had a moment of respect for all the money I lost.",76,Action|Shooter|Light Gun|,Sniper Elite VR
"Jul 19, 2016",GameDesignDan,Curve Digital,5.5,T,"If you want a cheesy story to go along with a hard platformer, this is for you! The game takes inspiration from Super Meat Boy, but faster paced. As the name implies, you have 10 seconds to finish the level. This is done by destroying every single robot (which there are a variety of), and not being electrocuted (which can also happen many ways). There are multiple ""stages"" that have multiple levels. These levels get progressively more difficult the more you complete, and each stage has it's own twist that changes how you play the game. Each stage also has different tilesets and music. In my opinion, the default control map is good, but be aware there is no control mapping. My only complaint is the learning curve. The levels, as I said, do get harder, but each time you enter a new stage, it becomes significantly more difficult, although I think that's the point. If you've never played a game like Super Meat Boy or 10 Second Ninja, you should definitely try this game.",76,Action|Platformer|2D|,10 Second Ninja X
"Oct 15, 2020",High Tea Frog,Coatsink Software,6.0,E,"<span class=""blurb blurb_collapsed"">Cake Bash<br/>Pretty Sweet<br/>Cake bash is a 4 player mini gm based competitive game that can be played either local or online and here you play as</span>",76,Miscellaneous|Party / Minigame|,Cake Bash
"Jul 28, 2021",Rainbite,EastAsiaSoft,tbd,T,"Magic and firearms make a deadly combo. Recalling the visual style and intuitive gameplay of 16-bit action-adventure classics, Trigger Witch puts an ultra-violent spin on cute and colorful pixel art. With a compelling and original narrative, puzzling environments to explore, a dynamic soundtrack, twin-stick shooter mechanics and a vast array of enemies to blast into smithereens, this is a tale that will grip you from start to bloody finish. From the creators of Reverie, Trigger Witch is a stylized 2D twin-stick action game set in an odd open world where magic is outdated and firearms are the new way of life. Players assume the role of Colette, a prospective graduate from the Stock, an academy for Witchcraft and Triggery. After a mysterious man invades her realm, events are set in motion that turn Colette’s life upside-down, casting her as the sole heroine with enough firepower to restore peace.",76,Action|Shooter|Shoot-'Em-Up|Top-Down|,Trigger Witch
"Oct 21, 2014",Flippfly,Flippfly,6.1,E,"<span class=""blurb blurb_collapsed"">You are a solar-powered craft. The sun is your death timer. Hurtle towards the sunset at breakneck speed in a futile race against time.<br/> <br/>You are a solar-powered craft. The sun is your death timer. Hurtle towards the sunset at breakneck speed in a futile race against time. Race The Sun is</span>",76,Action|Racing|General|Arcade|Futuristic|,Race the Sun
"Sep  3, 2021",Demagog Studio,Untold Tales,6.8,None,"Human life is wiped out. Earth is now a golf course for the ultra-rich. The rich fled to Mars but venture back to a desolate Earth for a round of golf. Each hole in the wasteland offers its own little story and possible puzzle to sink the perfect shot. Play through destroyed brutalist monuments, crumbling shopping malls, and abandoned museums as neon signs and poignant graffiti take swings at current events, Silicon Valley culture and humanity. Piece together the full story of how humanity fell through three distinct sources. Details from the lone golfer’s story, who's come back to Earth for one last game. The Radio Nostalgia From Mars broadcast that gives a glimpse into the lives of those who escaped. And the narration of a “secret spectator” watching from a distance...Be accompanied by a purposefully composed soundtrack as well as personal stories broadcasted on Radio Nostalgia From Mars. The station caters to citizens of Mars, nostalgic for Earth as they listen to music from the 2020s, and dial in to share their memories of the planet. A smooth-voiced radio DJ keeps the show flowing with updates and announcements hinting at a not-so-glamorous life on Mars. Three distinct modes mean every golfer can find something for their tastes. Casual players can focus just on the story and a relaxing scenic round of golf in Story Mode. Those looking for an extra challenge can beat each hole under par using skill and puzzle solving through Challenge Mode. While the total pros can try Iron Mode, where there’s almost zero room for error. Easy-to grasp controls and a minimalist UI underpin the whole game so anyone can easily pick up and play at their own pace. ",76,Adventure|Puzzle|Action|General|,Golf Club: Wasteland
"Jul 11, 2019",JoyMasher,The Arcade Crew,7.6,T,"After the abysmal Contra: Rogue Corps, I decided to try this as it looked similar to the Contra I love and grew up with, but man, I was not expecting it to be this good. The game has been made by people who clearly know what they are doing in terms of Contra style games (which this game is inspired by), and I highly recommend it to anyone who is looking for another Contra style game.",76,Action|Platformer|2D|,Blazing Chrome
"Dec  3, 2019",Square Enix,Square Enix,6.3,T,"<span class=""blurb blurb_collapsed"">Originally released in Japan in 2016, SaGa SCARLET GRACE lets you pick one of four distinct heroes - each with their own unique storylines. That means you essentially have four RPGs in a single game.<br/><br/>The version that launches in the West as SaGa SCARLET GRACE: AMBITIONS improves things</span>",76,Role-Playing|Japanese-Style|,SaGa: Scarlet Grace - Ambitions
"May 31, 2019",Squanch Games,Gearbox Publishing,8.1,M,"Your dogs have been dognapped by a beaked lunatic who stuffed them into his eye holes and is using their life essence to destroy the universe. You’re partnered with Trover, a little purple eye-hole monster who isn’t a huge fan of working or being put in the position of having to save the universe.",76,Action|General|Platformer|3D|,Trover Saves the Universe
"Sep 19, 2019",Die Gute Fabrik,Die Gute Fabrik,7.6,T,"A mutant soap opera where small-town gossip meets the supernatural. Join Kai as she arrives in the mysterious community of Mutazione to care for her ailing grandfather. Discover scenic hangouts, magical gardens, new friends, and old secrets… They can survive an apocalyptic meteor strike, but can they survive their small-town drama?",76,Adventure|Point-and-Click|,Mutazione
"Nov 14, 2017",Team Bondi,Rockstar Games,7.9,M,"Amid the post-war boom of Hollywood's Golden Age, Cole Phelps, an LAPD detective is thrown headfirst into a city drowning in its own success. Corruption is rampant, the drug trade is exploding, and murder rates are at an all-time high. In his fight to climb the ranks and do what's right, Phelps must unravel the truth behind a string of arson attacks, racketeering conspiracies and brutal murders, battling the L.A. underworld and even members of his own department to uncover a secret that could shake the city to its rotten core. Using groundbreaking new animation technology that captures every nuance of an actor's facial performance in astonishing detail, L.A. Noire is a violent crime thriller that blends breathtaking action with true detective work to deliver an unprecedented interactive experience. Search for clues, chase down suspects and interrogate witnesses as you struggle to find the truth in a city where everyone has something to hide.",76,Action Adventure|Adventure|3D|Open-World|Third-Person|,L.A. Noire
"Sep 25, 2020",Hangar 13,2K Games,6.9,M,"Part one of the Mafia crime saga - 1930s, Lost Heaven, IL Re-made from the ground up, rise through the ranks of the Mafia during the Prohibition era of organized crime. After a run-in with the mob, cab driver Tommy Angelo is thrust into a deadly underworld. Initially uneasy about falling in",76,Action Adventure|Open-World|,Mafia: Definitive Edition
"Jul 30, 2019",Electronic Arts,Electronic Arts,1.4,E,"Take the journey of an NFL superstar. Create a college quarterback and dominate the College Football Playoff, then impress the scouts at the NFL Combine. Find out where your story begins at the NFL Draft, and then fight to prove you belong in the league. Last long enough and you just might leave a legacy and even play in a few Pro Bowls. This new and customizable career campaign is all about you, with personalized playable scenarios, events, and dynamic challenges. The choices you make early on will affect how your career pans out.",76,Action|Sports|General|Team|Football|Sim|,Madden NFL 20
"Mar 15, 2017",Flying Oak Games,Plug In Digital,6.2,E10+,"Fast, retro, addicting, fun, Neurovoider is a twin stick shooter that comes at you with the powerful, violent bass of its synthwave",76,Action|Shooter|Shoot-'Em-Up|Top-Down|,NeuroVoider
"Dec  6, 2016",Ubisoft,Ubisoft,6.9,E,It's an absolute travesty that this game has received anything less than a 9 from both critics and users and I implore everyone with any VR,76,Miscellaneous|Party / Minigame|,Werewolves Within
"Jan 31, 2017",Infinity Ward,Activision,1.8,None,Sabotage is a very good dlc for Infinite Warfare. The new zombies map is especially great with a reference to an old classic horror movie. The,76,Action|Shooter|First-Person|Tactical|,Call of Duty: Infinite Warfare - Sabotage
"Oct 17, 2017",5pb,5pb,8.4,M,"Discover A Darker Japan - Explore Shibuya in 2015, after an earthquake nearly levelled the city six years prior, and try to outsmart the puppet-master behind this New Generation Madness. Track Down A Serial Killer - Play as Takuru, an arrogant senior and the newspaper club president, and discover the pattern in a series of bizarre deaths around you that the police can't seem to crack.",76,Adventure|General|Visual Novel|,Chaos;Child
"Aug  7, 2018",Zoink!,Rising Star Games,5.3,T,"A good and fun adventure game Fun and not frustrating puzzles and I like the hint system dead tells you what to do, but not in a way very they tell you their entire solution. I would highly recommend this game if you find it for a good price. I think this is a good spiritual Sequel to stick it to the man.",76,Action|Action Adventure|General|,Flipping Death
"Jan 30, 2018",Darkwind Media,Darkwind Media,6.4,M,None,76,Action|Beat-'Em-Up|2D|,Wulverblade
"Jun  5, 2018",ZeniMax Media,Bethesda Softworks,5.3,M,"The Elder Scrolls Online: Summerset is the next Chapter of ZeniMax Online Studios' award-winning online RPG, The Elder Scrolls Online (ESO). This new adventure in the ESO saga will send adventurers and their friends to the Summerset Isle, to visit and explore the ancestral home of the high",76,Role-Playing|Massively Multiplayer|,The Elder Scrolls Online: Summerset
