release_date,developer,publisher,userscore,rating,summary,metascore,genres,title
"Apr  5, 2016",Codemasters,Codemasters,7.9,E,"DiRT Rally features 39 of the most iconic and relevant cars from yesteryear through to modern day, representing the cars that the players want, and the ones that make the most sense for the surfaces they race on. Six rallies with over 70 stages. Head to the muddy paths of Wales, the dusty trails of Greece and the icy tarmac of Monte Carlo. Take on the legendary hillclimb of Pikes Peak, the snowy thrills of Sweden, and the epic scenery of Finland. DiRT Rally has the iconic locations to test your nerve and delight your senses. Race at the Lydden Hill, Holjes and Hell tracks in six of the fastest off-road cars and take on your friends in bumper-to-bumper multiplayer racing. ",85,Racing|Simulation|Automobile|,DiRT Rally
"Feb  2, 2016",Brace Yourself Games,Brace Yourself Games,6.6,T,"Crypt of the NecroDancer is a hardcore rhythm-based roguelike game. Can you survive this deadly dungeon of dance, slay the NecroDancer, and recapture your still beating heart? Or will you be a slave to the rhythm for all eternity? Players must move on the beat to navigate procedurally generated dungeons while battling dancing skeletons, zombies, dragons, and more! Groove with the game's epic dance soundtrack, or select songs from your own MP3 collection! You can even play with a dance pad to really shake your bones!",85,Action|Role-Playing|Rhythm|General|Action RPG|Music|,Crypt of the NecroDancer
"Sep 22, 2020",Vanillaware,Atlus,8.9,T,"I've gone into this game knowing nothing, my expectations were even high since I really enjoyed other Atlus games before but this still managed to blow my mind. If you want a game with a great plot, don't even think twice about picking it up, it always keeps you interested and wondering what's about to happen, I was barely able to leave it alone for two days because of how intrigued I was. I don't want to say anymore to not spoil the game but I wholeheartedly recommend it.",85,Role-Playing|Action RPG|Adventure|General|,13 Sentinels: Aegis Rim
"Nov 12, 2013",EA DICE,Electronic Arts,7.1,M,"Battlefield 4 is an action blockbuster that aims for unrivaled destruction. Fueled by Frostbite 3, Battlefield 4 allows you to demolish the buildings shielding your enemy. You will lead an assault from the back of a gun boat. Battlefield grants you the freedom to do more and be more while playing to your strengths and carving your own path to victory. Beyond its hallmark multiplayer, Battlefield 4 features an intense, dramatic character-driven campaign that starts with the evacuation of American VIPs from Shanghai and follows your squad's struggle to find its way home. Change the landscape in real-time with interactive environments that react to your every move. Dominate land, air and sea with all-new, intense water-based vehicular combat.",85,Action|Shooter|Shooter|First-Person|Modern|Modern|Arcade|,Battlefield 4
"Oct 25, 2019",Obsidian Entertainment,Obsidian Entertainment,8.0,M,"The Outer Worlds is a new single-player first-person sci-fi RPG from Obsidian Entertainment and Private Division. Lost in transit while on a colonist ship bound for the furthest edge of the galaxy, you awake decades later only to find yourself in the midst of a deep conspiracy threatening to destroy the Halcyon colony. As you explore the furthest reaches of space and encounter various factions, all vying for power, the character you decide to become will determine how this player-driven story unfolds. In the corporate equation for the colony, you are the unplanned variable.",85,Role-Playing|Western-Style|,The Outer Worlds
"Aug 29, 2017",Obsidian Entertainment,Paradox Interactive,7.1,M,"This is a game in Old-school ISO-metric gfx (similar to: Baldurs Gate, Diablo, Icewind Dale, Fallout 1-2 etc) is an outstanding RPG very",85,Role-Playing|Western-Style|,Pillars of Eternity: Complete Edition
"May 13, 2016",id Software,Bethesda Softworks,8.4,M,"There is no taking cover or stopping to regenerate health in campaign mode as you beat back Hell’s raging demon hordes. Combine your arsenal of futuristic and iconic guns, upgrades, movement and an advanced melee system to knock-down, slash, stomp, crush, and blow apart demons in creative and violent ways. In multiplayer, dominate your opponents in DOOM’s signature, fast-paced arena-style combat. In both classic and all-new game modes, annihilate your enemies utilizing your personal blend of skill, powerful weapons, vertical movement, and unique power-ups that allow you to play as a demon. DOOM SnapMap is an easy-to-use game and level editor that allows for limitless gameplay experiences on every platform. Anyone can snap together and customize maps, add pre-defined or custom gameplay, and edit game logic to create new modes. Instantly play your creation or make it available to players around the world. [ID/Bethesda]",85,Sci-Fi|Third-Person|Action|Shooter|First-Person|Arcade|,DOOM
"Nov 12, 2013",Visual Concepts,2K Sports,6.5,E,"Honestly NBA 2k14 is the BEST BASKETBALL SIMULATION EVER!!! However, if I was being a severe critic of realism I could say that the old school days of arcade NBA Jam style are still alive & well in this version of 2k. This, for Me, makes this My ATF (All-Time Fav) hoops game, & on the PS4 it's just absolutely gorgeous. The only gripe for true purists will be the over-the-top WWEish MyCareer mode which includes cheesy cut-scenes & the innately annoying knack for your counterpart to always be catching fire & carrying his team to an unrealistic degree. Having said that, when you're dropping 20 & 10 in your rookie showcase game you can understand the developers pushing your competition. For those who enjoyed catching fire in the heyday of NBA Jam you'll LOVE 2k14's varying levels of getting ""ON FIRE!!"", including defensively if you make a few good plays on D (steals, blocks, etc). The visuals are stunning, presentation is as realistic as I've ever seen & they even use the Real Voice feature to have real coaches & players during interviews. The online is a different twist on park hoops which allows you to watch & join games going on live by calling ""next"". There's more modes than you'll even have time for which makes for an overwhelmingly awesome full package. NBA 2k14 is the Best Basketball Game Ever. Good luck NBA Live!!! lol",85,Sports|Traditional|Team|Basketball|Sim|Sim|,NBA 2K14
"Sep 25, 2018",Team Cherry,Team Cherry,8.9,E10+,Wonderful game that finally came to PS4. Must buy for everyone who are at least a bit interested in metrovania style games. Gem in EA filled **** franchise-game industry.,85,Action|Action Adventure|General|Platformer|None|Metroidvania|,Hollow Knight: Voidheart Edition
"Oct 20, 2015",DONTNOD Entertainment,Square Enix,8.6,M,"Further proof that video games can tell emotionally engaging stories and present relatable characters. Superb voice acting, beautiful art design, a smooth score, and good use of licensed music all help to make this story game one worth playing. If you are looking to take a break from the usual RPGs and shooters, then I recommend you start with Life is Strange.",85,Sci-Fi|Action Adventure|General|,Life is Strange
"Sep 26, 2017",Image & Form,Image & Form,7.1,E10+,"The upgrades played a big role in the original Dig. This time they’re bigger, better and and will take you to places you’ve never been before. Besides carving your way through the earth with your trusty pickaxe, you will literally fly through caves with the Jet Engine and grab faraway treasure with the new Hookshot. Expect even more awesome gear as the game progresses. [Image & Form Games]",85,Action|Action Adventure|General|Platformer|2D|None|,SteamWorld Dig 2
"Sep 26, 2017",Team Ninja,Sony Interactive Entertainment,7.8,M,"<span class=""blurb blurb_collapsed"">The Siege of Osaka is over. The bloody Sengoku period is nearing its end and so too is William's adventure.<br/>In this final story expansion for Nioh return to Japan months after the events of ""Defiant Honor"" as the country teeters on the verge of war. With new allies at his side, William must</span>",85,Role-Playing|Action RPG|,Nioh: Bloodshed's End
"Jul  7, 2015",Psyonix,505 Games,8.4,E,An incredible game created by incredible developers that care for quality and their fans. Psyonix have put so much effort into creating this,85,Racing|Futuristic|Sports|Team|Soccer|Arcade|,Rocket League
"Sep 19, 2017",SquareSoft,Square Enix,8.6,T,"The last Final Fantasy for the PlayStation, Final Fantasy IX returns to the pure fantasy roots that spawned the series.  This latest installment features highly detailed characters, vehicles, and environments, and breathtaking cinema-graphics.  The addition of brand new features such as the story-enhancing Active Time Event system and the return of minigames that grant additional gameplay make Final Fantasy IX not only a memorable gaming experience, but also a significant step forward in the series.",85,Role-Playing|Japanese-Style|,Final Fantasy IX
"Feb 17, 2015",Housemarque,SCEA,7.2,E10+,"Resogun is a Epic game for you and your friends play together in the PS4 and, surprise your friends with the fun and long game for the entire fun everyday.",85,Action|Shooter|Shoot-'Em-Up|Horizontal|,Resogun: Defenders
"Sep 13, 2016",Konami,Konami,7.3,E,"In PES 2017, the 1st touch is calculated by player attributes, as well as the further inclusion of real ball physics directly controlled by the input ball touch. See how different players control the ball in unique and different ways based on where and how you control them, dictating the flow of the game based on how they react to the unpredictable movement of the ball. In addition, there is more control in how you receive passes, and depending on the pass, players can visually execute the exact play intended, from receiving a pass to sending the ball out again. [Konami]",85,Sports|Team|Soccer|Sim|,Pro Evolution Soccer 2017
"Mar  6, 2018",Rocky Studio,Neowiz,7.9,T,"Why not? With the massive and lovely initial library of songs, great difficulty spread, and with the promising updates of songs, this is a real treat for anyone who loves rhythm games.",85,Action|Rhythm|Music|,DJMax Respect
"Sep 29, 2020",Schell Games,Schell Games,7.3,None,"<span class=""blurb blurb_collapsed"">From the team behind I Expect You To Die, this arcade-inspired VR hack-and-slash roguelite will force you to find and master your own fighting style for hours of frantic, kinetic fun.<br/><br/>Rokar has fallen. Once a civilization fueled by a magical power called Aether, the Rokari have been</span>",85,Action|Beat-'Em-Up|3D|,Until You Fall
"Oct 15, 2020","Jackbox Games, Inc.","Jackbox Games, Inc.",4.7,T,"Five new games: the hit threequel Quiplash 3, the collaborative chaos of The Devils and the Details, the fierce drawing game Champ’d Up, the speech game Talking Points and the guessing game Blather 'Round. Use phones or tablets as controllers and play with up to 8 players, and an audience of 10,000.",85,Miscellaneous|Party / Minigame|,The Jackbox Party Pack 7
"Jul 15, 2021",Seaven Studio,DotEmu,7.2,None,"The fight continues in Wood Oak City. After the events of Streets of Rage 4, our heroes wanted to prepare themselves for future threats. Axel, Blaze and their mates will start a very special deranged training with the help of Dr. Zan, who built an AI program from the remnants of Mister X’s",85,Action|Beat-'Em-Up|2D|,Streets of Rage 4: Mr. X Nightmare
"Sep 15, 2021",Studio Thunderhorse,Humble Games,6.9,E10+,"A 2D platformer with quality gameplay, beautiful artistic visuals, passable audio, and an interesting story that's not too overbearing.",85,Action|Platformer|2D|Metroidvania|,Flynn: Son of Crimson
"Sep 12, 2017",Falcom,NIS America,8.5,T,Amazing RPG! iF youre a fan of the ys saga then this is a must! Endless vistas of beauty and an amazing storyline that keeps you hooked at all times!!!,85,Role-Playing|Action RPG|,Ys VIII: Lacrimosa of DANA
"Mar 13, 2020",Team Ninja,Koei Tecmo Games,7.9,M,"Master the lethal arts of the samurai as a mysterious half-human, half-supernatural Yokai warrior, in this challenging action RPG sequel. Explore violent Sengoku-era Japan and the deadly Dark Realm, both plagued with grotesque, merciless demons. Unsheathe your deadly weapons and cut down all enemies in your path using a revamped combat system and the ability to transform into a full Yokai to unleash devastating paranormal powers. ",85,Role-Playing|Action RPG|,Nioh 2
"Feb 18, 2020",PlatinumGames,Sega,8.2,M,"Celebrate the 10th Anniversary of two PlatinumGames cult classics with the Bayonetta & Vanquish 10th Anniversary Bundle. Bayonetta: Experience the genesis of the Bayonetta series with the cult classic, original action-adventure game. Vanquish: The hit sci-fi shooter returns. An overpopulated Earth suffocating under limited resources looks to Providence, the solar-powered space colony for support. ",85,Miscellaneous|Compilation|,Bayonetta & Vanquish
"Jan 24, 2017",Ryu ga Gotoku Studios,Sega,8.6,M,"The story follows Kazuma Kiryu as a junior yakuza member who finds himself in a heap of trouble when a simple debt collection goes upside down and his mark ends up murdered. Meanwhile, Goro Majima is living a ""normal"" life as the proprieter of a cabaret club, but is doing whatever it takes to rejoin the yakuza. What that entails isn't exactly easy.",85,Action Adventure|Open-World|,Yakuza 0
"Mar 28, 2017",Sony Interactive Entertainment,Sony Interactive Entertainment,6.9,E,Freaking awesome. Any true ballplayer would appreciate the game they've put together with The Show. Didn't play another game for a full 7 months after it's release... it's THAT good.,85,Sports|Team|Baseball|Sim|,MLB The Show 17
"Sep  6, 2017",Bungie,Activision,5.0,T,"In Destiny 2, the last safe city on Earth has fallen and lays in ruins, occupied by a powerful new enemy and his elite army, the Red Legion. Every player creates his own character called a “Guardian,” humanity’s chosen protectors.  As a Guardian in Destiny 2, players must master new abilities and weapons to reunite the city’s forces, stand together and fight back to reclaim their home. In Destiny 2 players embark on a fresh story filled with new destinations around our solar system to explore, and an expansive amount of activities to discover.  There is something for almost every type of gamer in Destiny 2, including gameplay for solo, cooperative and competitive players set within a vast, evolving and exciting universe. [Bungie]",85,Action|Shooter|First-Person|Arcade|,Destiny 2
"Mar  8, 2016",Witch Beam,Witch Beam,6.3,E10+,"This is really great game. If You like fast action twin stick shooters with smooth controls, nice level of challenge, variety and good a/v",85,General|Scrolling|Action|Shooter|Shoot-'Em-Up|Top-Down|,Assault Android Cactus
"Dec 16, 2014",Metalhead Software,Metalhead Software,7.2,E,"<span class=""blurb blurb_collapsed"">This game is brilliant i can't stop playing it.<br/> <br/>I was looking for a game similar to NHL hits, NBA street and NBA street Volume 2 but for</span>",85,Traditional|Sports|Team|Baseball|Arcade|,Super Mega Baseball
"Aug 28, 2018",Sega,Sega,8.4,M,"Kazuma Kiryu thought his Tojo Clan days were behind him. He and his young ward, Haruka Sawamura, have built a peaceful life from the ashes of conflict. All it took was a single gunshot to shatter that peace. Yukio Terada, the fifth chairman of the Tojo Clan, has been assassinated. With war on the horizon, the legendary Dragon of Dojima is pulled back into the world he wanted to leave behind. ",85,Action Adventure|Open-World|,Yakuza Kiwami 2
"May  8, 2018",WayForward,PQube,7.4,T,"Iconic genie Shantae is back in her most thrilling adventure yet! The award-winning 2D platforming series levels-up to stunning new heights thanks to an eye-popping new graphical style, an infectious soundtrack and incredible new game features. Transform into different creatures, dance",85,Action|Platformer|2D|,Shantae: Half-Genie Hero - Ultimate Edition
"Jul 29, 2014",Cellar Door Games,Cellar Door Games,7.7,E10+,"<span class=""blurb blurb_collapsed"">Each time you die, your child will succeed you. Every child is unique. One child might be colorblind, another might have tourettes-- they could even be a dwarf.<br/> <br/>That's OK, because no one is perfect, and you don't have to be perfect to win this game. But you do have to be pretty darn good</span>",85,Action|Platformer|Platformer|2D|2D|,Rogue Legacy
"Jun  6, 2017",Sony Interactive Entertainment,Sony Interactive Entertainment,8.0,E10+,"A name synonymous with PlayStation, Wipeout is the rapid combat racer that defies gravity and defines generations. Known for its blistering speed, iconic music and pure multiplayer mayhem, Wipeout has starred on every PlayStation format since 1995  and is now set to rip through the air on PlayStation4 and PlayStation4 Pro. Featuring all the content from Wipeout HD, Fury and 2048, Wipeout Omega Collection packs in 26 reversible circuits, 46 unique ships, a ton of game modes and some new and classic music tracks. Its time for Wipeout veterans to come out of retirement and new pilots to make their debut.",85,Racing|Arcade|Futuristic|,Wipeout: Omega Collection
"Mar  1, 2016",NetherRealm Studios,Warner Bros. Interactive Entertainment,7.6,M,"GREAT, Absolute fun. play it when people come over and everybody will want to join in. fun party game or play alone and indulge in story mode and tower mode.",85,Action|Fighting|2D|,Mortal Kombat XL
"Nov 25, 2014",Lucid Games,Sierra Games,7.3,E,"There is nothing revolutionary here with the mechanics but it happens to be the best twin stick shooter I have ever played.  Controls, gameplay and graphics are all excellent.  Mixes things up a lot in adventure mode and really keeps you wanted to progress.   Only knock would be that it could use more music tracks as after hours of playing you really don't want to hear the songs anymore.",85,Action|Shooter|Static|Shoot-'Em-Up|Top-Down|,Geometry Wars 3: Dimensions
"Apr 12, 2016",Insomniac Games,SCEA,8.4,E10+,"Play the game, based on the movie, based on the game. Ratchet & Clank (PS4) is a new game based on elements from the original Ratchet & Clank (PS2). Developed alongside the major motion CG-animated picture coming to theatres in 2016, Ratchet & Clank (PS4) marks the PlayStation 4 debut of PlayStation's greatest heroes. Join Ratchet, Clank, Captain Qwark and new friends as they battle to save the Solana Galaxy from the evil Chairman Drek. With an hour of new cinematics (including footage from the film), Ratchet & Clank (PS4) takes a deeper look at the characters' origin stories and modernizes the original gameplay. Explore the galaxy in a game that features new planets, new and updated gameplay segments, all-new bosses, all-new Clank gameplay, all-new flight sequences, and much more --- with completely new visuals built to demonstrate the power of the PS4. Battle your enemies with an out-of-this-world arsenal, including new weapons and fan-favorite tools of destruction from the Ratchet & Clank Future series. From the brand new Pixelizer (which transforms enemies into explosive 8-bit pixels) to franchise favorites like the dance-party-inducing Groovitron and wise-cracking robotic bodyguard Mr. Zurkon, Ratchet & Clank's arsenal has never been better. Help Ratchet and Clank save the galaxy for the first time, again, exclusively on PlayStation 4.",85,Action|Platformer|3D|,Ratchet & Clank
"Mar 29, 2016",SCEA San Diego Studios,SCEA,7.3,E,"ShowTime takes critical in-game Road To The Show moments and slows them down to give you maximum control. Make Gold Glove plays and come through in the clutch with this tool that allows finer, more focused user control. Immersive Road To The Show – With a curated in-game environment and a revamped training system that includes Gameplay Perks, The Show 16 offers a more personalized experience that acknowledges key moments of your career as you travel from a nobody to the Hall of Fame. An improved “Topps Prospect Showcase” includes Bowman Scout Day and a new 20-80 scale scouting report. Streamlined game logic maximizes the time spent in situations that matter. Conquest Mode – This single-player online experience takes your Diamond Dynasty team on the road as you travel through North America en route to becoming America's most popular team. As you earn fans, strategically move them to hold territories or help take over new territories as you attempt to achieve baseball manifest destiny.",85,Sports|Team|Baseball|Arcade|Sim|,MLB The Show 16
"Sep 25, 2018",Sega,Sega,8.1,T,I only played the first game for a few chapters before getting into a hard wall that stopped me from progressing (chapter 6 if I'm correct),85,Strategy|Turn-Based|Tactics|,Valkyria Chronicles 4
"Nov 18, 2014",Ubisoft Montreal,Ubisoft,7.7,M,"Hidden in the towering Himalayas lies a country steeped in tradition and violence. You are Ajay Ghale, returning to the country of your birth, the lush forests and harsh snow capped summits of Kyrat, to fulfill your mother’s dying wish of spreading her ashes. This vast and unpredictable country offers visitors opportunity and danger. You quickly find yourself caught up in a rebellion to overthrow the oppressive regime of Pagan Min, a figure known as much for his sense of style and charisma as for his cruelty and naked brutality. Navigating the treacherous landscape, you find your fate increasingly determined by the choices you make because in Kyrat, and every second is a story. In Far Cry 4, you’ll conquer fortress outposts from the back of a 6-ton elephant and take to the skies as you rain down explosives from your moving perch in the gyrocopter. The vertical landscape of the Himalayas isn’t just a gorgeous backdrop, but a playground that encourages the player to fight, hunt and explore, grappling cliffs or launching into the air, plummeting to the valley below in a controlled free fall with your wing suit. You’ll carry with you a truly unique arsenal of weaponry that lets you play your way, whether it’s sniping, sneaking or all-out assault. When all else fails, animals can be your biggest allies or your greatest peril, as Kyrat’s wilderness delivers on the promise of a true open world anecdote factory.",85,Action|Shooter|First-Person|Modern|Arcade|,Far Cry 4
"Feb 27, 2018",Polyarc,Sony Interactive Entertainment,8.1,E10+,"Meet Quill, a young mouse with dreams of greatness beyond the confines of her quiet settlement. One day while exploring the woods, she finds a mysterious stone and an ancient magic is awakened. Dramatic events quickly unfold as a distant evil extends its reach. With her uncle now in grave danger, Quill must embark on an epic journey—and she needs you there by her side. Together, you'll travel to forgotten realms, solve challenging puzzles, and battle menacing enemies. Alone, no one can conquer what you're up against. But united, you just may defeat even the darkest of villains. Immerse yourself in the world of Moss to help write the story of a hero in the making. [Playstation.com]",85,Action Adventure|General|,Moss
"Jan 28, 2014",Crystal Dynamics,Square Enix,8.1,M,"Very well crafted game. A bit short but well worth the price on sale. If you played the old Tomb raiders you know the game is not only about combat but also puzzles. Here the puzzles of the main story are quite easy, while those of optional stuff can be quite challenging. I like this choice.",85,Modern|Action Adventure|General|Modern|Linear|,Tomb Raider: Definitive Edition
"Aug  1, 2017",Mimimi Productions,Daedalic Entertainment,8.4,M,"The tactical game with stealth elements Shadow Tactics: Blades of the Shogun is a cooperative endeavor of Daedalic Entertainment and Mimimi Productions. The game is a special take on the genre: it takes place during the Edo-Era of Japan in 1615. Within a playtime of roughly 25 hours, 5 characters will face challenging missions, each protagonist with their own special field of expertise. Only if you know the positive and negative qualities of your characters and play tactically and with finesse, will you master the challenges ahead.",85,Strategy|Real-Time|Tactics|,Shadow Tactics: Blades of the Shogun
"Oct  6, 2015",Team Meat,Team Meat,7.0,T,"I've already put in many hours on the Steam version and even though it is super difficult, I don't mind starting over on PS4, that's how good it is. If you haven't given this game a try, you should definitely download it now. (The soundtrack is different, and admittedly not as good as the original, but that doesn't take away much from the experience.)",85,Action|Platformer|2D|,Super Meat Boy
"Jul 25, 2017",Supergiant Games,Supergiant Games,8.0,E10+,"First off, if you can't stomach visual novels you'll want to avoid this. During the first four hours, the gameplay has far more RPG-style",85,Role-Playing|General|,Pyre
"Sep 27, 2016",EA Sports,Electronic Arts,5.0,E,"EA SPORTS FIFA 17 The Journey isa new game mode powered by Frostbite. Immersed in The Journey, fans live their story on and off the pitch as Premier League prospect, Alex Hunter who is looking to make his mark. Fans visit new football worlds, meet new characters full of depth, and navigate emotional highs and lows of their unique story arc through decisions off the pitch, their performance on it, and character interactions throughout the 2016/17 season while playing for any of the 20 Premier League clubs. [Electronic Arts]",85,Sports|Team|Soccer|Sim|,FIFA 17
