release_date,developer,publisher,userscore,rating,summary,metascore,genres,title
"Oct  2, 2020",Ravenscourt,Deep Silver,tbd,T,"Sing alone or share the stage with your friends in compelling game modes while you follow in the footsteps of Queen, the biggest rock band ever, with the legendary lead singer Freddie Mercury. Let their music take you on a trip through different decades. Master “Bohemian Rhapsody”, challenge",77,Action|Rhythm|Music|,Let's Sing Queen
"Jun  1, 2021",Sega,Sega,6.6,T,"Challenge the greatest fighters in the world in the ultimate remaster of the classic 3D fighter, now featuring gorgeous HD graphics, new online features, and all the bone-crunching, martial arts combat of the renowned original. Master your fighting style to defeat all challengers in the Fifth World Fighting Tournament and become a Virtua Fighter legend!",77,Action|Fighting|3D|,Virtua Fighter 5 Ultimate Showdown
"Oct  6, 2015",PlatinumGames,Activision,7.6,T,This is the best transformers game in a long time. The animation looks like the origional G1 cartoon but better of coarse. Fun story and dynamic of combining weapons. This is a very fun game and well worth $50.00. They could do so much with this genre. I hope for a sequel and more playable bots!,77,Action|Beat-'Em-Up|3D|,Transformers: Devastation
"Apr  4, 2017",TT Games,Warner Bros. Interactive Entertainment,7.4,E10+,"In LEGO City: Undercover developed by TT Games and published by Nintendo, players assume the identity of Chase McCain, an undercover detective armed with clever disguises. As players run, drive and even fly through the city, they'll use the Wii U GamePad as a map, communicator and indispensable crime scanner. This is the first time that the LEGO City play sets have come to life on a gaming platform and it's exclusively on the Wii U console.",77,Action Adventure|Open-World|,LEGO City Undercover
"Sep  1, 2015",Renegade Kid,Renegade Kid,5.6,E,"Drifting through the stars. Xeodrifter is the story of an interstellar drifter traveling the stars on a simple mission of exploration. We join our nomad as he embarks on the investigation of a small cluster of four planets in the omega sector, after a collision with a rogue asteroid damaged his warp core. Blast your way through alien landscapes, seek out valuable secrets, and defeat ancient guardians to unlock powers from a legendary supreme culture in this exciting journey of mystery and adventure.",77,Action|Platformer|2D|,Xeodrifter
"Jul 21, 2015",Telltale Games,Telltale Games,6.8,M,"In this penultimate episode, the actions of every Forrester are vital to the survival of the house. Rodrik's alliance with House Glenmore, and his defiance of the Whitehills, has drawn the ire of an even greater threat: Ramsay Snow. Far across the Narrow Sea in Essos, with Meereen now a free city, Asher is close to securing the army he desperately needs to return home, and save his family. In King's Landing, Mira's activities at Tommen's coronation have not escaped the attention of Margaery Tyrell, and Cersei has realized that the handmaiden may prove useful in her political games. Finally, beyond the Wall, Gared's unlikely allies are reluctant to help in the search for the North Grove... but this far into the frozen wilds, Crows and Free Folk have a common enemy; and winter is coming.",77,Action|Adventure|General|Point-and-Click|,Game of Thrones: Episode Five - A Nest of Vipers
"Nov 17, 2017",Bethesda Softworks,Bethesda Softworks,8.1,M,"A true, full-length open-world game for VR has arrived from award-winning developers, Bethesda Game Studios. Skyrim VR reimagines the complete epic fantasy masterpiece with an unparalleled sense of scale, depth, and immersion. From battling ancient dragons to exploring rugged mountains and",77,Role-Playing|Western-Style|,The Elder Scrolls V: Skyrim VR
"Oct 10, 2016",Sony Interactive Entertainment,Sony Interactive Entertainment,7.9,E,"It's free and you get Robot Rescue.  That's enough reason to give it 10.  Now Sony, can we have a full version of Robot Rescue as a stand alone game, that'd be great.",77,Miscellaneous|Party / Minigame|,The Playroom VR
"Nov  4, 2016",Infinity Ward,Activision,4.2,M,"Infinite Warfare is the first game in the franchise to venture beyond the reaches of Earth, framing a plausible future war in our solar system.  Infinite Warfare also introduces an original cooperative Zombies mode that takes players on a wild ride through a new storyline with unique gameplay features and mechanics. [Infinity Ward]",77,Action|Shooter|First-Person|Tactical|,Call of Duty: Infinite Warfare
"May  1, 2018",Metalhead Software,Metalhead Software,6.5,E,"The pitching mechanics are great. Hitting is pretty solid as well. The game looks nice, has incredible customization, solid season stat tracking an customization, and the fielding, from moving a player to diving or jumping for a ball, is satisfying. Diving for a ball takes practice to time it, but once you do that, it's really fun.",77,Sports|Team|Baseball|Arcade|,Super Mega Baseball 2
"May 12, 2015",PixelNAUTS,PixelNAUTS,7.1,T,"LOST ORBIT tells the story of Harrison, an astronaut and his struggle to return home. Despite his lack of resources, Harrison will relentlessly strive to survive hopeless conditions. Along his mission he encounters evidence that his accident was not an isolated incident and confronts a strange and dangerous alien race.",77,Action|Platformer|2D|,Lost Orbit
"Aug 15, 2017",Bloober Team,Aspyr,7.0,M,"What would you do if your fears were hacked? The year is 2084. You are Daniel Lazarski, an elite neural detective known as an Observer, whose purpose is to hack and invade suspects’ minds. To gather evidence, you must relive their darkest fears, and, finally, face your own. From Bloober Team, the creators of Layers of Fear, >observer_ is a cyberpunk horror game designed to disturb you.",77,Adventure|3D|First-Person|,Observer
"Feb 14, 2017",Rebellion,Rebellion,7.2,M,"<span class=""blurb blurb_collapsed"">Welcome to Italy, 1943.<br/> <br/>Set in the aftermath of its award-winning predecessor, Sniper Elite 4 continues the series World War Two heritage by transporting players across the beautiful Italian peninsula, from sun-drenched Mediterranean coastal towns, to colossal Nazi mega structures,</span>",77,Action|Shooter|First-Person|Tactical|,Sniper Elite 4
"Apr 11, 2017",Abstraction Games,Badland Games,7.7,T,a great and uniqe game mostly games like this are too few. classic art and nice game theme and good story if you are looking for a diffrent game this is it,77,Adventure|General|,The Sexy Brutale
"Oct 29, 2019",Digital Eclipse,Nighthawk Interactive,5.0,E10+,"Two Disney games make their long-awaited return to modern consoles in Disney Classic Games: Aladdin and The Lion King. This package of Disney classics is filled with tons of new features, enhancements, game modes, and display options, plus multiple versions of the games. Join Aladdin and his sidekick, Abu, as they race through the marketplace toward their date with destiny. Relive Aladdin’s classic adventure as you travel through Agrabah, the Cave of Wonders and more to defeat Jafar and rescue Jasmine.  Jump, fight, dodge and carpet-ride your way through this adventure, collecting gems along the way.  The Lion King brings to life the majesty and mystery of Africa through the tale of Simba, a lion cub faced with the challenging transition to maturity. Now, you too can be part of the adventure.  Driven into the wilderness by his evil uncle Scar, Simba finds salvation and Hakuna Matata with Pumbaa the warthog and Timon the meerkat.  Tackle heinous hyenas in the elephant’s graveyard, avoid the trampling hooves of stampeding wildebeest as you battle through 10 levels to ensure Simba claims his rightful place as The Lion King.",77,Miscellaneous|Compilation|,Disney Classic Games: Aladdin and the Lion King
"Sep 10, 2019",Electronic Arts,Electronic Arts,3.7,E10+,"EA SPORTS NHL 20 introduces cutting-edge gameplay innovation to showcase your skills, more customization to unlock your style, and new modes to compete with friends. RPM Tech-powered gameplay introduces Signature Shots that replicate your favourite NHL players' real-world shot styles. Over",77,Sports|Team|Ice Hockey|Sim|,NHL 20
"Feb 18, 2014",Double Helix Games,Capcom,7.1,E10+,"Originally released in 1989, Strider remains one of Capcom's most enduring franchises.  The game tells the story of Hiryu, the youngest ever ""Super A"" ranked agent of an elite corps known as the Striders.  Strider Hiryu receives orders to assassinate Grandmaster Meio, supreme dictator of Earth, who has plunged humanity into a dystopian dark age.",77,Fantasy|Action Adventure|General|Fantasy|,Strider
"May 30, 2017",Falcom,DotEmu,7.3,T,"700 years before the events of Ys I & II, the land of Ys was on the brink of destruction. Demons came in droves and forced the twin Goddesses who ruled the land to whisk their subjects away from the surface, into the safe embrace of the clouds. The demons were persistent, however, erecting a massive tower in pursuit. The battle that raged upon the ground had begun ascending for a second round up above.",77,Role-Playing|Action RPG|,Ys Origin
"Mar 10, 2015",Capcom,Capcom,7.0,M,"Resident Evil Revelations 2 - Episode 1 required; sold separately. Xbox Live free membership required. Xbox Live Gold membership required for multiplayer features. Episode Three: Judgment Neil is caught in the Overseer's trap. Following a clue he left behind, Claire and Moira search for a",77,Action Adventure|Survival|,Resident Evil: Revelations 2 - Episode 3: Judgment
"Oct 14, 2014",United Front Games,Square Enix,7.5,M,"The Definitive Edition of the critically acclaimed, award winning open-world action adventure, reworked, rebuilt and re-mastered for Xbox One. All 24 previously available DLC extensions from the Xbox 360 version have been integrated into the game, including the story-extending episode Year",77,Action Adventure|Modern|Open-World|,Sleeping Dogs: Definitive Edition
"Aug 20, 2019",Gunfire Games,Perfect World Entertainment,7.0,M,I bought it because I liked the gameplay of streamed videos and don't regret it. It's fun in multiplayer with a buddy or just helping other players. Playing alone is really challenging. Make use of the mods with the right weapons to defeat bosses (and work together). In my opinion you need to use different strategies for bosses.,77,Action|Shooter|Third-Person|Arcade|,Remnant: From the Ashes
"Mar 11, 2016",Io Interactive,Square Enix,5.3,None,this game is fantastic to play. i enjoying stealth and assassinate targets.. graphic is great.  i am not sure if story is great because there are 7 episodes in whole game. i will rate story when i complete full game with 7 episodes. Enemies seem little smart and little dumb. Kudos to IQ devs,77,Action Adventure|General|,Hitman - Intro Pack
"Jul 26, 2016",Double Fine Productions,Adult Swim,7.0,T,"Assume the role of the last known human in the universe, and all that's left of you is a disembodied head. Seeking clues to your fractured past, you must travel through a hostile world of machines using a special helmet that allows you to dock into and take control of any robotic host body. As you launch from one body to the next, you'll start to discover that things are not quite what they appear to be, and the fate of humanity has yet to be decided. From Double Fine Productions, Headlander is a a retro-futuristic, side-scrolling, action-adventure game set in a world inspired by 70’s science fiction. It's a world of automation, a utopia gone wrong in which all of humanity have transferred their minds into robotic imposter bodies and are ruled by a deranged computer.",77,Action|Action Adventure|General|Platformer|2D|,Headlander
"Mar 21, 2017",Koei Tecmo Games,Koei Tecmo Games,7.5,T,"Slayers: Go forth and eradicate the Oni menace. Experience the latest hunting action game featuring a dynamic targeted destruction system. From the battlefield to the village that serves as your base of operations, the game takes place in a vast “open world.” Explore the vast world for yourself, and enjoy hunting action from an entirely new perspective. [Playstation.com]",77,Role-Playing|Action RPG|,Toukiden 2
"Jan 22, 2018",Telltale Games,Telltale Games,7.2,M,"Everything that's been building up the past two episodes finally comes to fruition in a very satisfying episode. Some intense action scenes, difficult choices that WILL have a lasting effect, and terrific writing makes this one of the best episodes that TT has ever done",77,Adventure|Point-and-Click|,Batman: The Enemy Within - Episode 4: What Ails You
"Jan 21, 2020",VitruviusVR,VitruviusVR,7.1,M,"Shadow Legend is an action-adventure game exclusively designed for virtual reality where you play as the Grand Master of the Knights Templar in a story-driven medieval crusade. Freely explore densely filled worlds and use your sword, bow, and magic skills to save your kingdom from the destruction of Lord Adaroth.",77,Role-Playing|Action RPG|,Shadow Legend VR
"Jul 30, 2020",Team Ninja,Sony Interactive Entertainment,7.9,M,"Horrible it would be nice if I could ACTUALLY access the DLC. And yes I have beaten the game, I have tryed all the methods listed online to access the dlc but it still keeps saying buy it when I own the season pass. Don't waste your time with garbage that won't work.",77,Role-Playing|Action RPG|,Nioh 2: The Tengu's Disciple
"Aug 30, 2016",Fiddlesticks Games,Curve Digital,7.3,E,"Hue is a puzzle-platformer through which you alter the world by changing its background color. You explore a dangerous grey land, unearthing colored fragments on a journey to find your missing mother. As obstacles match the background, they disappear, creating new puzzles full of peril, mystery, and colors unseen.",77,Puzzle|Action|,Hue
"Oct 23, 2018",Ubisoft Paris,Ubisoft,5.8,E,"Dance to 40 hits, from ""Finesse (Remix)"" by Bruno Mars Ft. Cardi B. Jump into an even more personalized experience, with a newly curated homepage. 8 exclusive choreographies created with the help of kids' development experts to encourage healthy movement. Join even more multiplayer events",77,Action|Rhythm|Dancing|,Just Dance 2019
"Nov  5, 2019",Ubisoft Paris,Ubisoft,5.3,E10+,"Gather your friends and family and Just Dance like nobody's watching with Just Dance 2020! The 1 Music Video Game Franchise of All Time, with over 67 million units sold, is back this Fall. The newest, freshest Just Dance celebrates 10 years of bringing people together with 40 new hot tracks,",77,Action|Rhythm|Dancing|,Just Dance 2020
"Sep 10, 2020",Lucky Mountain Games,Sumo Digital,6.3,E10+,"Fantastic arcade racing game. Reminds me of the classic Sega arcade games like Outrun, Daytona and Virtua racing. The action is fast and frantic. One of the best games this generation.",77,Racing|Arcade|Automobile|,Hotshot Racing
"Jul  5, 2016",The Game Bakers,The Game Bakers,7.8,M,"Furi is a game where you fight for a reason. It’s a game that teases you before the fight, while you walk toward your fate, the same way you would be pumped up and stressed before a boxing match. As you do, you’ll start to piece together about why you’re here and what you’re fighting for. [The Game Baker / Playstation.com]",77,Action|Action Adventure|General|Fighting|3D|,Furi
"Apr 15, 2021",Square Enix,Square Enix,6.3,T,"The 1998 PlayStation® classic is back: SaGa Frontier is remastered. The team of eight have returned – now with Fuse added as a playable character. Choose your favorite character and embark on your own unique journey. Each of the eight characters have different goals and endings. Your choices will affect how events unfold using the Free-Form Scenario System. This in-depth system will allow you to manipulate and expand a story all your own. Challenge yourself in nail-biting battles by using “glimmer"" as well as learning new skills such as the ability to fire consecutive special attacks from multiple team members.",77,Role-Playing|Japanese-Style|,SaGa Frontier Remastered
"Nov 12, 2020",Giant Squid,Giant Squid,7.7,E10+,"From the creators of ABZÛ, The Pathless is a mythic adventure game about an archer and an eagle in a vast forest. Become the Hunter, a master of archery who travels to a mystical island to dispel a curse of darkness that grips the world. Forge a connection with your eagle companion as you hunt corrupted spirits, but be careful not to become the hunted yourself. Explore misty forests full of secrets, solve puzzles in ancient ruins, and test your skill in epic battles. The bond with your eagle and the fate of the world hang in the balance. [Giant Squid]",77,Action Adventure|General|Open-World|,The Pathless
"May  2, 2017",KO-OP,KO-OP,7.0,E10+,"GNOG is a 3D puzzle game set in a tactile world of toys and secrets. Point, click, grab, poke, spin, pull, and play with uniquely charming monster heads, and explore the hidden worlds inside them from your couch, or face-to-face in stunning PlayStation VR. Filled with eye-catching designs, playful interactions, and a rich, reactive soundtrack, the hand-crafted heads come to life in your hands. Inspired by real-world toy designs, every GNOG head is a miniature world to discover. Grab a bookcase and spin it to reveal a hidden pile of coins, slide levers to navigate a damaged ship through outer space, crank a wheel to cook a stew on the stove – each playful interaction generates lively feedback and surprising consequences. Set to a relaxing and dynamic soundtrack that evolves with each level, the surreal worlds and joyful puzzles of GNOG will have you turning heads. [Playstation.com]",77,Adventure|General|,GNOG
"Feb 14, 2020",Airship Syndicate Entertainment,THQ Nordic,7.3,T,"From the dawn of creation, the council has maintained the Balance across existence. Carrying out their orders are the Horsemen, Nephilim (powerful beings spawned from the unnatural union of angels and demons) who have pledged themselves to the Council and been granted immense power.",77,Role-Playing|Action RPG|,Darksiders Genesis
"Sep  2, 2014",Omega Force,Koei Tecmo Games,6.6,T,"The best in the series, the story is very good mixing Chinese and Japanese mythology, the gameplay is fluid and have good addictions and new",77,Action|Beat-'Em-Up|3D|,Warriors Orochi 3 Ultimate
"Sep 23, 2014",Hidden Path Entertainment,505 Games,7.2,E10+,"Defense Grid 2, DG2, is the highly-anticipated sequel to Hidden Path Entertainments 2008 Defense Grid: The Awakening. Setting the bar as the definitive tower defense game, Defense Grid 2 introduces new worlds and threats to test your tower placement strategies. With a bold new look, a compelling single-player campaign, and the addition of new game modes, online player-versus-player and multiplayer co-op, every play-through brings fun new opportunities and challenges. DG2 comes with a story campaign featuring 21 stunning maps, dynamic level movement, an expanded story and cast of characters, hundreds of challenge mode experiences, new multiplayer modes, a procedurally driven audio score and the ability for players to build their own levels. DG2 also introduces players to DG Architect, a level creation tool set connected to Steam Workshop where players can create their own unique levels to share and possibly even sell if selected. DG2 for the PC was funded in part by Dracogen, a private investor after a 2012 Kickstarter campaign funded the original game's DLC, Defense Grid: Containment. DG2 is developed by Hidden Path Entertainment and published by 505 Games.",77,Strategy|Real-Time|General|Defense|,DG2: Defense Grid 2
"Apr 11, 2017",Mad Fellows Ltd,Mad Fellows Ltd,5.1,E10+,"Speed through stunning, stylised environments tracing ribbons of light, releasing the energy in the music. Battle strange enemies and fight epic boss battles all driven by an incredible licensed soundtrack.",77,Action|Shooter|Rail|,Aaero
"Aug  7, 2018",Survios,Survios,6.2,E,This is a fantastic music arrangement/creation tool which transforms a classical step sequencer into a virtual reality playground. Well done!,77,Action|Miscellaneous|Rhythm|Application|Music|,Electronauts
"Mar 17, 2020",Ubisoft Chengdu,Ubisoft,tbd,None,"<span class=""blurb blurb_collapsed"">[Also known as Uno Ultimate Edition] Brace yourself for a new UNO® experience with the UNO FLIP! DLC. Rediscover the matching game you know with a double-sided deck that gives the classic gameplay an exciting twist.<br/> <br/>Flip the deck with the special Flip card and spice things up with a new</span>",77,Miscellaneous|Board / Card Game|,Uno Flip!
"Apr 18, 2017",Capcom,Capcom,6.4,E10+,"There is a lot of quality, a lot of heart and a lot of soul in this collection. I hope the developers will continue  their work with many other great games that are waiting for their time.",76,Miscellaneous|Compilation|,The Disney Afternoon Collection
"Apr 28, 2015",Haemimont,Kalypso,7.1,T,"Chock full of a host of new gameplay features and new artwork designed from scratch, Tropico 5 takes the series into a new direction - dynasties. You, as El Presidente, will first take control of the infamous island of Tropico during early colonial times and then guide it through the centuries as the world changes and moves ever forward. ",76,Tycoon|Business / Tycoon|Strategy|Management|Government|,Tropico 5
"Feb 27, 2018",Secret Location,Secret Location,7.2,T,"Fun, challenging and immersive. Exciting retro graphics and a variety of weapons and enemies. My only wish is that it had some kind of online co-op, it would truly be a blast to play with a friend. Highly recommended for anyone looking for a visually appealing shooter with lots of replayability.",76,Action|Shooter|First-Person|Arcade|,Blasters of the Universe
"Jun  3, 2014",Gaijin Entertainment,Gaijin Entertainment,5.3,T,"War Thunder - best combat game dedicated to World War II military aviation, armored vehicles, and fleets. Now testing armored vehicles. Most playing. Gaijin`s testing WW2 tanks now. Air-ground combats WW2 in 1 game - very good.",76,Action|Simulation|General|Flight|Vehicle|Combat|,War Thunder
"Jan 24, 2017",Square Enix,Square Enix,8.2,E10+,"KINGDOM HEARTS HD 2.8 Final Chapter Prologue is a compilation of 3 magical KINGDOM HEARTS experiences: Originally released in 2012, KINGDOM HEARTS Dream Drop Distance HD is a full-HD remastered version of KINGDOM HEARTS 3D Dream Drop Distance, brought to console for the first time. Series protagonists Sora and Riku take on the Mark of Mastery exam in preparation for coming threats. The signature action of the KINGDOM HEARTS series has evolved, allowing players to experience faster-paced battles and exploration at a blistering pace. KINGDOM HEARTS χ Back Cover (movie) A new HD movie that tells the mysterious story of the Foretellers, connecting the earliest parts of the series’ history, showcased in the mobile title KINGDOM HEARTS Unchained χ. KINGDOM HEARTS 0.2 Birth by Sleep – A Fragmentary Passage – A completely new playable episode that links to the story of KINGDOM HEARTS III, taking place after the storyline of KINGDOM HEARTS Birth by Sleep played from the perspective of Aqua. [Square-Enix]",76,Miscellaneous|Compilation|Role-Playing|Action RPG|,Kingdom Hearts HD 2.8 Final Chapter Prologue
"Sep  9, 2014",Bungie Software,Activision,6.1,T,"In Destiny (from the creators of Halo) you are a Guardian of the last city on Earth. You are able to wield incredible power. Explore the ancient ruins of our solar system, from the vast dunes of Mars to the lush jungles of Venus. Defeat Earth’s enemies. Reclaim all that we have lost. Become legend. Embark on an epic action adventure with rich cinematic storytelling where you unravel the mysteries of our universe and reclaim what we lost at the fall of our Golden Age. The next evolution of the first-person action genre that promises to provide an unprecedented combination of storytelling, cooperative, competitive, and public gameplay, and personal activities that are all woven into an expansive, persistent online world. Venture out alone or join up with friends. The choice is yours. Personalize and upgrade every aspect of how you look and fight with a nearly limitless combination of armor, weapons, and visual customizations. Take your upgraded character into every mode, including campaign, cooperative, social, public, and competitive multiplayer.",76,Shooter|Sci-Fi|Action|Shooter|First-Person|Sci-Fi|Arcade|,Destiny
"Oct  5, 2018",Yuke's,2K Games,6.1,T,"WWE 2K19 arrives as the latest entry to the flagship WWE video game franchise and features cover Superstar AJ Styles. WWE 2K19 will showcase a massive roster of popular WWE Superstars, Legends and Hall of Famers, as well as NXT favorites. Experience authentic WWE gameplay, extensive creation options, engaging match types, fan-favorite modes and much more!",76,Sports|Individual|Combat|Wrestling|,WWE 2K19
"Dec  9, 2020",2 Ton Studios,Big Sugar Films,5.0,None,Great game! But I think it would be better on an app. Seems like a tier 1 app game. I love it but wish I could play it on my phone or tablet. Love the dark creeping along in the dark even with a torch. Which you of course drop when you enter battle.,76,Action Adventure|General|,Unto The End
"Jan 29, 2021",Gauntlet Games,Crunching Koalas,tbd,None,None,76,Action|Miscellaneous|General|Party / Minigame|,Bonkies
"Jun  5, 2018",Arc System Works,Arc System Works,6.6,T,"<span class=""blurb blurb_collapsed"">THE COLLISION IS INEVITABLE! THE IMPACT WILL BE UNAVOIDABLE!<br/>An unrivaled clash of explosive proportions! The beloved BlazBlue franchise Crosses universes, Tags in fan favorites, and Battles it out in BlazBlue: Cross Tag Battle! Created through an all-star collaboration between BlazBlue,</span>",76,Action|Fighting|2D|,BlazBlue: Cross Tag Battle
