genres,metascore,developer,userscore,rating,publisher,title,summary,release_date
Adventure|General|,79,Hollow Ponds and Richard Hogg,tbd,None,Annapurna Interactive,I Am Dead,"Morris Lupton is the recently-deceased museum curator of the tiny island of Shelmerston who is reunited with the ghost of his dog Sparky, only to discover that a disaster is about to destroy his beloved island. Together, they must uncover Shelmerston's ancient mysteries, prevent the island's","Aug 10, 2021"
Adventure|General|Action Adventure|Sandbox|,79,Unknown Worlds Entertainment,5.5,E10+,Bandai Namco Games,Subnautica: Below Zero,Below Zero is an underwater adventure game set on an alien ocean world. It is a new chapter in the Subnautica universe and developed by Unknown Worlds. Return to planet 4546B. Dive into a freezing underwater adventure. Below Zero is set in an arctic region of planet 4546B. As a scientist,"May 14, 2021"
Action Adventure|General|,78,Electronic Arts,7.8,E10+,Electronic Arts,Lost in Random,"Play the odds in Lost in Random™, a gothic fairytale-inspired action adventure where every citizen’s fate is determined by the roll of a dice. Ruled by a wicked Queen, the kingdom of Random is divided into six shadowy realms where life is dictated by a cursed black dice. In this story, from the award-winning Swedish game studio Zoink and penned by Eisner Award-winning Adventure Time and Marvel Comics The Unbeatable Squirrel Girl author Ryan North, you’ll join Even, a penniless girl who’s down on her luck, in a dark quest to save her beloved sister. With her companion Dicey, a small and strange living dice, Even must learn to embrace the chaos of Random, uncovering an age-old tale with a modern message. Walk Random’s mysterious cobbled streets, meet its unpredictable residents, and take on courageous quests. Engage in fearsome battles with a unique blend of tactical combat, card collection, and explosive dice gameplay. It’s time to adapt or perish, as you battle inside giant board game arenas that change with every dice throw! Learn how to tip the odds in your favor, and dive into a dark wonderland where only the brave survive.","Sep 10, 2021"
Strategy|Management|Business / Tycoon|,78,Frontier Developments,6.6,T,Frontier Developments,Jurassic World Evolution 2,"Jurassic World Evolution 2 is the sequel to Frontier’s Jurassic World Evolution, building upon the 2018 management simulation. It introduces a compelling, new narrative campaign, incredible new features, and awe-inspiring new dinosaurs brought to life with captivating authenticity. Together","Nov  9, 2021"
Action|Adventure|General|Platformer|3D|,78,ONE MORE LEVEL,6.8,None,505 Games,Ghostrunner,"If you liked the first Mirror's Edge, you'll love this! The gameplay is fast and very addictive, the graphics are very good on PS5 and the music is amazing. A great surprise can't wait for the sequel.","Sep 28, 2021"
Role-Playing|Japanese-Style|,78,Gust,7.8,T,Koei Tecmo Games,Atelier Ryza 2: Lost Legends & the Secret Fairy,"Three years have passed since Ryza’s secret grand adventure on Kurken Island. Ryza, the only member of her group to remain on the island, receives a letter from her friend telling her about ruins that may be related to alchemy, along with a mysterious request involving a glowing stone. This inspires her to leave the island and venture out to the royal capital, Ashra-am Baird. However, Ryza is unaware that this will lead to the beginning of an imaginative new adventure involving a pursuit of the mysteries of the ruins surrounding the royal capital and a meeting with a strange creature that will change her life.","Jan 26, 2021"
Action|Shooter|First-Person|Arcade|,78,Ratloop Games Canada,tbd,T,Frontier Foundry,Lemnis Gate,"Lemnis Gate is a time-warping, turn-based combat strategy FPS. Over five alternating turns taking place in a 25” time-loop, you are called to master the unique abilities of a varied cast of deep-space operatives and outskill, outsmart, and outmanoeuvre your opponent in mind-bending","Sep 28, 2021"
Sports|Team|Baseball|Sim|,78,Sony Interactive Entertainment San Diego Studio,4.1,E,Sony Interactive Entertainment,MLB The Show 21,"Be a 2-way star. For the first time, take your Ball Player from Road To The Show and use him in other game modes. Now your Ball Player can be a 2-way star. Enjoy Franchise improvements and updates to March To October which empower you to better make decisions on the future of your club. Live","Apr 16, 2021"
Racing|Simulation|Automobile|,78,Milestone S.r.l,5.1,E,Milestone S.r.l,MotoGP 22,"The best Race Game that I ever play in my life, it is so amazing. yeah, it is hard, but you need to practice in time trial for a time, after","Apr 21, 2022"
Sports|Team|Baseball|Sim|,78,Sony Interactive Entertainment San Diego Studio,5.8,E,Sony Interactive Entertainment,MLB The Show 22,"Diamond Dynasty is back. Play, collect, and build on your fantasy card collection and bring to life on the diamond*. Try the new Mini Seasons mode, where each season brings new challenges as you face off against a new set of competition. Create and use multiple Ballplayers, beyond your Road","Apr  1, 2022"
Sports|Team|Soccer|Sim|,78,EA Canada,2.5,E,Electronic Arts,FIFA 22,"Powered by Football™, EA SPORTS™ FIFA 22 brings the game even closer to the real thing with fundamental gameplay advances and a new season of innovation across every mode. New gameplay features in FIFA 22 give you more consistency between the posts with a goalkeeper rewrite that brings more","Sep 27, 2021"
Strategy|Real-Time|General|,78,Rebellion,5.5,T,Rebellion,Evil Genius 2: World Domination,"Evil Genius 2 is a satirical spy-fi lair builder, where players take control of an Evil Genius and set their plans for world domination in motion. When it feels this good to be bad, the Forces of Justice don't stand a chance. Build your own unique evil lair and cover operation, train a force of criminal minions, defend your lair from the Forces of Justice, and dominate the world with a doomsday device in this direct sequel to the 2004 cult classic!","Nov 30, 2021"
Action|Platformer|2D|,78,Rickard Paulsson,tbd,T,Red Art Games,Gunborg: Dark Matters,"Gunborg: Dark Matters is an arcade-style, action-packed platformer in space, with smooth gameplay and a slick 80’s synth-wave soundtrack. Armed with a fierce blade and a powerful shield your challenge is to fight your way through a  mad alien spaceship filled with deadly creatures and","Mar  4, 2022"
