genres,metascore,developer,userscore,rating,publisher,title,summary,release_date
Miscellaneous|Compilation|,84,Ghost Town Games Ltd.,6.9,E,Team17,Overcooked! All You Can Eat,"Overcooked! All You Can Eat sees Overcooked! and Overcooked! 2 blended together with all additional content and remastered up to 4K in a delicious definitive edition. Making use of the power of the PS5, Overcooked! AYCE offers stunning 4K visuals, cross-platform multiplayer, and rapid loading times — meaning more time for culinary carnage! ","Nov 12, 2020"
Action Adventure|Survival|,84,Capcom,8.5,M,Capcom,Resident Evil Village,"The next generation of survival horror rises in the form of Resident Evil Village, the eighth major entry in the Resident Evil series. With ultra-realistic graphics powered by the RE Engine, fight for survival as danger lurks around every corner. Years after the tragic events of Resident Evil 7 biohazard, Ethan Winters has started over with his wife Mia, finally living in peace and putting the past behind them. However, Chris Redfield, the legendary hero from previous Resident Evil games, suddenly disrupts their life, throwing a devastated Ethan into a new and twisted nightmare in search of answers.","May  7, 2021"
Action Adventure|Open-World|,84,Sucker Punch,7.7,None,PlayStation Studios,Ghost of Tsushima: Iki Island,"If you’re a history buff, you may know that in addition to Tsushima, the neighboring island of Iki was also invaded during this time period. This island serves as the setting for a whole new chapter in Jin’s journey. In this new story, Jin travels to the island to investigate rumors of a Mongol presence. But soon, he finds himself caught up in events with deeply personal stakes that will force him to relive some traumatic moments from his past. [Sony]","Aug 20, 2021"
Action|General|Miscellaneous|Board / Card Game|,83,11 bit studios,tbd,None,11 bit studios,This War of Mine: Final Cut,"<span class=""blurb blurb_collapsed"">The Remastered Final Cut version for PS5 is finally here!<br/>In This War Of Mine, you do not play as an elite soldier, rather as a group of civilians trying to survive in a besieged city; struggling with a lack of food, medicine and constant danger from snipers and hostile scavengers. During</span>","May 10, 2022"
Puzzle|Action|,83,Skookum Arts LLC,6.8,E10+,Skookum Arts LLC,The Pedestrian,"Amo jogos de quebra cabeça e este é muito muito bom! Dificuldade crescente, mecânicas bem explicadas e desafiadoras sem serem muito frustrantes, além de um estilo de arte legal. Pontos negativos são a curta duração, não aproveitar mais o último e surpreendente tipo de quebra cabeça e falta de mais trofeus, inclusive platina.","Jan 29, 2021"
Action|Platformer|3D|,83,JapanStudio,9.2,E10+,Sony Interactive Entertainment,Astro's Playroom,"The game is a great example of how the controller can be utilised in gaming. I found myself numerous times smiling at what I was 'feeling' happening. It is a charming demo that oozes nostalgia and celebrates what the playstation was and has become. A must play, and a pleasure to play.","Nov 12, 2020"
Action|Shooter|First-Person|Arcade|,83,4A Games,7.9,M,Deep Silver,Metro Exodus: Complete Edition,"<span class=""blurb blurb_collapsed"">The year is 2036.<br/><br/>A quarter-century after nuclear war devastated the earth, a few thousand survivors still cling to existence beneath the ruins of Moscow, in the tunnels of the Metro.

They have struggled against the poisoned elements, fought mutated beasts and paranormal horrors, and</span>","Jun 18, 2021"
Role-Playing|Action RPG|,83,Team Ninja,7.9,None,Sony Interactive Entertainment,Nioh 2 Remastered: The Complete Edition,"<span class=""blurb blurb_collapsed"">Although it is more of the same in design and scenery, the gameplay has become more complex.<br/>Seems to be a bit more difficult, which is why I</span>","Feb  5, 2021"
Action Adventure|Open-World|,83,Ryu ga Gotoku Studios,8.4,M,Sega,Judgment,"From the makers of the acclaimed Yakuza series, Ryu Ga Gotoku Studio, Judgment is the dramatic tale of a disgraced lawyer seeking redemption in a world rife with corruption and despair. Investigate the seedy Red Light District of Kamurocho by stepping into the mind of private detective Takayuki Yagami and utilize innovative investigation systems to uncover the secrets that lie deep within Kamurocho's corrupt underbelly. Experience visceral combat with two unique combat styles. Take down groups of thugs with sweeping blows in Crane Style, then switch to Tiger to overwhelm a single foe with a series of powerful strikes. Practice mixing-and-matching styles in combat in conjunction with a wide variety of skills, weapons, and powerful (and hilarious) EX Actions to unlock a whole new dimension in combat.","Apr 23, 2021"
Strategy|Turn-Based|Card Battle|Tactics|,83,Abrakam SA,tbd,E10+,Nacon,Roguebook,"The ancients speak of a Book written since time immemorial containing all the world's legends. After many fabulous adventures, recounted in Faeria Chronicles of Gagana, this relic was lost in a well of Faeria. Through contact with this source of magic, the Book developed a wicked free will","Feb 24, 2022"
Puzzle|Action|Platformer|2D|,83,Graphite Lab,tbd,E,Atari Games,Kombinera,"<span class=""blurb blurb_collapsed"">Control multiple colored balls simultaneously in this brain-bending puzzle platformer. It's up to you to combine every ball and complete each perilous level. Can you solve them all? Can you save King Kombine from the Kave of Kaos?<br/> <br/>Core Features:
-Progress through 300 increasingly complex</span>","Apr  7, 2022"
Action Adventure|Linear|,82,Asobo Studio,8.1,M,Focus Home Interactive,A Plague Tale: Innocence,"Follow the grim tale of young Amicia and her little brother Hugo, in a heartrending journey through the darkest hours of history. Hunted by Inquisition soldiers and surrounded by unstoppable swarms of rats, Amicia and Hugo will come to know and trust each other. As they struggle to survive against overwhelming odds, they will fight to find purpose in this brutal, unforgiving world.","Jul  6, 2021"
Action Adventure|Open-World|,82,SegaSoft,8.7,M,SegaSoft,Lost Judgment,"SEIZE THE TRUTH - December 2021, Tokyo district court. Akihiro Ehara stands accused of groping a woman on a crowded train. A bystander’s video footage of his attempt to flee the scene and subsequent apprehension is all over the news, and public outcry demands a maximum sentence. “Three days","Sep 24, 2021"
Action Adventure|General|,82,Warner Bros. Interactive Entertainment,8.3,E10+,Warner Bros. Interactive Entertainment,LEGO Star Wars: The Skywalker Saga,"LEGO Star Wars: The Skywalker Saga will feature hundreds of playable characters - the most ever for a LEGO Star Wars game - and ships, LEGO's signature sense of humour and fun, and new innovations, options, and gameplay features. Players can start the game at any point in the Star Wars","Apr  5, 2022"
Action|Platformer|2D|,82,IguanaBee,tbd,M,Untold Tales,What Lies in the Multiverse,"<span class=""blurb blurb_collapsed"">What Lies in the Multiverse is a story-driven puzzle platformer filled to the brim with hijinks, chaos, and reality-bending adventure.<br/><br/>Harness the power of the multiverse! Switch worlds in mid-air, turning pitfalls into bridges, walls into tunnels, and foes into friends. Just be careful</span>","Mar  4, 2022"
Racing|Simulation|Automobile|,82,KT Racing,7.5,None,Nacon,WRC 9 FIA World Rally Championship,"Best rally game that I have ever played, and I've tried them all (dirt 3,4,5,rally,rally2.0,wrc 5,6,7,8) The graphics are stunning and the attention to detail is endless. The controls are more similar to dirt rally rather than previous wrcs, except this is even better. They also made great use of the DualSense ps5 controller. Everything combined makes for a very realistic driving experience.","Nov 12, 2020"
Adventure|General|,82,Polygon Treehouse,tbd,None,United Label,Roki,"<span class=""blurb blurb_collapsed"">Every dark fairytale has its monster.<br/><br/>Rediscover magic and chart your adventure through this forgotten northern world of mystery and monsters. Find your courage, discover hidden paths, solve ancient puzzles and travel deeper through the icy land to learn the truth.

Join Tove on a</span>","Oct 28, 2021"
Adventure|3D|First-Person|,82,Digixart Entertainment,7.1,T,Merge Games,Road 96,"<span class=""blurb blurb_collapsed"">Summer 1996. Today is the day! You hit the road. Adventure. Freedom. Escape. Run. Flee the Regime. Try to survive. On this risky road trip to the border, you'll meet incredible characters, and discover their intertwined stories and secrets in an ever-evolving adventure.<br/>But every mile opens</span>","Apr 14, 2022"
Role-Playing|Action RPG|,81,Square Enix,8.2,T,Square Enix,Final Fantasy VII Remake Intergrade: Episode INTERmission,"It’s an awesome DLC. I loved everything in it. The graphics, the Story, the great mini games which were very fun to play. For me it was an perfect DLC for the great Final Fantasy 7 Remake Game and is worth the money.","Jun 10, 2021"
Action Adventure|Open-World|,81,Rockstar North,2.5,M,Rockstar Games,Grand Theft Auto V,"Los Santos: a sprawling sun-soaked metropolis full of self-help gurus, starlets and fading celebrities, once the envy of the Western world, now struggling to stay afloat in an era of economic uncertainty and cheap reality TV. Amidst the turmoil, three very different criminals plot their own","Mar 15, 2022"
Action|Shooter|First-Person|Tactical|,81,CI Games,7.0,M,CI Games,Sniper Ghost Warrior Contracts 2,"Sniper Ghost Warrior players have never taken down targets from such extreme distances before. Sniper Ghost Warrior Contracts 2 introduces fans to a dramatic single-player campaign where the stakes are at their highest, deep inside enemy territory. Players take on the role of Reaper,","Aug 24, 2021"
Role-Playing|Action RPG|,81,Blizzard Entertainment,3.9,M,Activision,Diablo II: Resurrected,"Diablo® II: Resurrected™ is a remastered version of the quintessential action RPG Diablo® II. Pursue the mysterious Dark Wanderer and fight the denizens of hell as you uncover the fate of the Prime Evils Diablo, Mephisto, and Baal. Features: Remastered graphics—monsters, heroes, items, spells, all resurrected. An epic story told through five distinct acts. Classic gameplay—the same Diablo II you know and love, preserved. Updated Battle.net support. Planned support for cross-progression—take your progress wherever you play. Diablo II: Resurrected includes all content from both Diablo II and its epic expansion Diablo II: Lord of Destruction®. Battle your way through icy caverns, horrific tombs filled with undead abominations, and frozen wastelands to the frigid summit of Mount Arreat and stop Baal, the Lord of Destruction. Raise hell with two Lord of Destruction playable classes—the cunning Assassin, master of traps and shadow disciplines, and the savage Druid, a bold shapeshifter and summoner who commands primal elemental magic.","Sep 23, 2021"
Action Adventure|Linear|,81,Okomotive,7.2,E,Frontier Foundry,FAR: Changing Tides,Easy puzzle and platforming gameplay with beautiful visuals and music. I think the ship is a little cumbersome to operate which does take away a bit for the gameplay; It makes it hard to appreciate the the sights and sounds when you’re fumbling with this mechanical monstrosity. Overall a very fun game though with a charming wordless story.,"Mar  1, 2022"
Action Adventure|General|,81,Deck Nine Games,6.7,M,Square Enix,Life is Strange: True Colors,"<span class=""blurb blurb_collapsed"">A bold new era of the award-winning Life is Strange begins, with an all-new playable lead character and a thrilling mystery to solve!<br/> <br/>Alex Chen has long suppressed her 'curse': the supernatural ability to experience, absorb and manipulate the strong emotions of others, which she sees as</span>","Sep 10, 2021"
Role-Playing|Action RPG|,81,Odd Bug Studio,7.1,T,United Label,Tails of Iron,"Set in a grim land plagued by war, Tails of Iron is a hand-drawn RPG Adventure with punishingly brutal combat. As Redgi, heir to the Rat Throne, you must restore your broken Kingdom by banishing the merciless Frog Clan and their ferocious leader, Greenwart. As you explore the deceivingly charming world, you'll encounter a cast of unique companions, ready to aid you in your adventure. And you'll need all the help you can get, whether that's new meal recipes, blueprints to forge deadly weapons and armour, or even a land-chugging, armour-plated mole mobile! Overcome your fears. Rescue your brothers. Restore Your Kingdom. Your tail has begun. Master Brutal Combat: From frog zombies to gargantuan grubs - and everything in-between - the Kingdom is awash with danger. To overcome each perilous encounter, you'll need to study your opponent's attacks and react accordingly! Thankfully, there's a range of deadly abilities at your disposal, including parry bashes and fatal executions, not to mention ranged attacks with your nifty bow and arrow. Explore a Treacherous Kingdom: Fully accompanied by the deep, raspy narrations of Doug Cockle (voice of Geralt of Rivia from The Witcher), prepare to embark on an epic adventure across the mediaeval-fantasy Rat Kingdom. Complete side quests and faction hunts for some additional gold-on-the-side, or join forces with a sharp-eyed companion to help even the playing field. Customise your Attack: Adapt Redgi's combat style to the task at hand. Heavy armour may provide better protection but can you really afford to slow down your dodge-roll? And then there's the question of weapon; axes pack a punch, while spears are quick and nimble. Perhaps you'd prefer the all-round performance of a trusty broadsword? ","Sep 17, 2021"
Adventure|General|,81,Beethoven & Dinosaur,tbd,None,Annapurna Interactive,The Artful Escape,"<span class=""blurb blurb_collapsed"">On the eve of his first performance, Francis Vendetti struggles with the legacy of a dead folk legend and the cosmic wanderings of his own imagination.<br/><br/>In an attempt to escape the musical legacy of his uncle, a teenage guitar prodigy embarks on a psychedelic journey to inspire his new stage</span>","Jan 25, 2022"
Strategy|Management|Business / Tycoon|,81,Frontier Developments,6.2,E,Frontier Developments,Planet Coaster: Console Edition,"The TRUE successor to Sim Theme Park from PS1, I am blown away by how amazing this game is. As a long fan of the genre, nothing quite hit the same level of love that I had for Sim Theme Park. This game takes that game and pushes it beyond anything I could have imagined. The depth and creation that you have at your finger tips is incredible. All I can say is this is the best Coaster Sim game I have played on any console, and it’s not even close. Runs smooth as butter for me and looks amazing on PS5. Please don’t hesitate on buying it if you love these type of games.","Nov 12, 2020"
Open-World|Action Adventure|General|,81,Emberlab,8.5,T,Emberlab,Kena: Bridge of Spirits,"A beautiful game and probably my favorite looking game so far on the PlayStation 5.  Simple gameplay, yet some of the encounters can be very difficult.  It rewards you for mastering the controls and you do end up getting better after some deaths.  The platforming and puzzles are basic yet entertaining.  The exploration is one of the best parts of the game while the story is the weakest, though not bad and doesn't ruin the game.","Sep 21, 2021"
Adventure|General|,80,Something We Made,4.0,E,Something We Made,TOEM,"A photo adventure. Set off on a delightful expedition and use your photographic eye to uncover the mysteries of the magical TOEM in this hand-drawn adventure game. Chat with quirky characters, solve their problems by snapping neat photos, and make your way through a relaxing landscape!","Sep 17, 2021"
Action|Beat-'Em-Up|3D|,80,Sloclap,8.1,M,Sloclap,SIFU,"Sifu is a stylish yet gritty beat-em-up, featuring visceral hand-to-hand combat in a contemporary urban setting. From Sloclap, creators of acclaimed PS4 fighting game Absolver, Sifu follows a young kung fu student on a path of revenge, hunting for the murderers of his family. One against","Feb  8, 2022"
Action|Action Adventure|Platformer|Open-World|Metroidvania|,80,TIGAMES,7.8,E10+,bilibili,F.I.S.T.: Forged In Shadow Torch,"Six years ago, the Machine Legion invaded and colonized the Torch City, which was originally inhabited by animals. Rayton, the former soldier in the resistance war, has been living in seclusion since then. After his friend is forcibly arrested, Rayton reclaims his mechanical fist and steps","Sep  7, 2021"
Role-Playing|Action RPG|Action Adventure|Linear|,80,Eidos Montreal,8.7,T,Square Enix,Marvel's Guardians of the Galaxy,"Fire up Star-Lord’s jet boots for a wild ride across the cosmos in this third-person action-adventure game, a fresh take on Marvel’s Guardians of the Galaxy. With the unpredictable Guardians at your side, blast your way from one explosive situation to another, with original and iconic Marvel characters caught in a struggle for the fate of the universe. You got this. Probably.","Oct 26, 2021"
Racing|Simulation|Automobile|,80,505 Games,7.7,E,505 Games,Assetto Corsa Competizione,"Assetto Corsa Competizione is an extraordinary racing simulation game allowing players to experience the real atmosphere of the GT3 championship, competing against official drivers, teams, cars and circuits reproduced in-game with the highest level of accuracy ever achieved. Sprint, Endurance and Spa 24 Hours races come to life with an incredible level of realism, in both single and multiplayer modes. Born from KUNOS Simulazioni's long-term experience, this racing simulator takes full advantage of Unreal Engine 4 to ensure photorealistic weather conditions and graphics, night races, motion capture animations, reaching a new standard in terms of driving realism and immersion, thanks to its further improved tyre and aerodynamic models.","Feb 22, 2022"
Racing|Simulation|Automobile|,80,Codemasters,5.4,E,Codemasters,DIRT 5,"On PS5, experience technical advances brought to life in an amplified off-road racer, such as faster loading times, greater graphical fidelity and a 120FPS option. Dirt 5 also utilises ps5's dual sense Controller features, including haptic feedback and adaptive triggers, so you can feel every bump, scrape and slide behind the wheel. All dirt 5 players on PlayStation 4 are entitled to a free upgrade to the next-gen optimized version on PlayStation 5.","Nov 12, 2020"
Adventure|Visual Novel|,80,Team Salvato,8.0,M,Serenity Forge,Doki Doki Literature Club Plus!,"<span class=""blurb blurb_collapsed"">Welcome to the club! Write poems for your crush and experience the terror of school romance in this critically-acclaimed psychological horror story.<br/> <br/>Enter the #1 Psychological Horror Experience!

Welcome to a terrifying world of poetry and romance! Write poems for your crush and erase</span>","Jun 30, 2021"
Strategy|Turn-Based|Card Battle|,80,Konami,7.1,T,Konami,Yu-Gi-Oh! Master Duel,"<span class=""blurb blurb_collapsed"">Now you can play the ""Yu-Gi-Oh! TCG,"" digitally, anywhere.<br/>Fast-paced Duels with stunning HD graphics and a new, dynamic soundtrack! Get ready to challenge Duelists around the world!<br/>◇Play Duels at Any Level!
The full Yu-Gi-Oh! experience is available for anyone at any Skill Level. Don't</span>","Jan 19, 2022"
Puzzle|General|,80,Light Brick,tbd,None,LEGO Games,LEGO Builder's Journey,"<span class=""blurb blurb_collapsed"">LEGO Builder's Journey is an atmospheric, geometric puzzle game that asks us to sometimes follow the instructions and sometimes to break the rules.<br/><br/>Take your time to experiment with free-form puzzle solving while immersing yourself in a poetic world of LEGO bricks. Throughout the narrative,</span>","Apr 19, 2022"
Action Adventure|Open-World|Role-Playing|Action RPG|,80,Bandai Namco Games,7.8,T,Bandai Namco Games,Scarlet Nexus,"Unleash the Power of the Mind - In a far distant future, a psionic hormone was discovered in the human brain, granting people extra-sensory powersand changing the world as we know it. Just as humanity was entering this new era, deranged mutants known as Others began to descend from the sky","Jun 25, 2021"
Racing|Arcade|Automobile|,79,Bugbear,7.5,T,THQ Nordic,Wreckfest,"Break the rules and take full-contact racing to the limit with Wreckfest! Expect epic crashes, neck-to-neck fights over the finish line and brand-new ways for metal to bend -- These are the once-in-a-lifetime moments that can only be achieved in Wreckfest, with its true-to-life physics","May  4, 2021"
Action|Fighting|2D|,79,SNK Corporation,7.3,T,Koch Media,The King of Fighters XV,"Since its debut in 1994, the KOF fighting game series has been driving the world to excitement with its appealing characters and unique game system. Six years have passed since the last title in the series, and now KOF XV surpasses all of its predecessors in terms of graphics, systems, and","Feb 14, 2022"
Action|Platformer|3D|,79,Sumo Digital,8.6,E,Sony Interactive Entertainment,Sackboy: A Big Adventure,To start I would like to say this is a game I definitely see myself replaying years down the line. The missions had a great balance of fun and difficulty to them after the first few. The customization of mixing and matching different costumes was great and fun to play around with. Vex was a great villain but the story left a lot to be desired for me. I haven't played any of the LBP games and that may be why i don't understand the story and why vex is doing what he is doing and why he even showed up. That's the only grip i have with this game please go pick it up.,"Nov 12, 2020"
Action Adventure|General|,79,Deck Nine Games,5.6,None,Square Enix,Life is Strange: True Colors - Wavelengths,"Steph Gingrich is one of the, unfortunately few, queer characters in videogames to be written as an actual character, without any harmful","Sep 30, 2021"
Action Adventure|General|Role-Playing|Action RPG|,79,Fallen Flag Studio,5.2,None,United Label,Eldest Souls,"Eldest Souls is a challenging, pixel-art boss-rush game. The Old Gods have long been imprisoned. Humanity has prospered. Great Kingdoms have arisen from the now forsaken temples of worship. But no longer… In their final act of vengeance, the Old Gods have unleashed a great Desolation upon the world. Farmlands have turned to deserts, rivers to dust. The Great Crusade sent to slay the imprisoned Gods once and for all, has all but perished, and the human Kingdoms are in disarray. A lone Crusader approaches the Citadel, ancient prison of the Gods. His objective is simple: slay them all.","Jul 29, 2021"
Sports|Team|Basketball|Arcade|,79,Visual Concepts,2.6,E,2K Games,NBA 2K21,"Visual Concepts has done it again with making a true next-gen game for the PlayStation 5. This game not only looks better, but plays better than last generation version, by leaps and miles. The graphics are absolutely stunning, gameplay feels as authentic as you can get to the real life thing, and some new additions have been made to MyCareer. MyCareer has extra options in the story mode of the game including going to the G-League rather than College, but the big addition is ""The City"". The City is an updated version of The Park. The City offers a large area where there is a ton of different options to explore, it's still a work in progress from a navigation stand point, but the ambition is going in the right direction. Only real constructive things I can mention that I would like improved is some more upgrades to MyLeague which is a great mode, but would benefit from extra addition such as the ability to play G-League games. I really like this game and do strongly recommend any fans of the NBA to check it out.","Nov 12, 2020"
Action|Platformer|3D|,79,Nicolas Meyssonnier,tbd,None,Headup Games,Pumpkin Jack,"<span class=""blurb blurb_collapsed"">Follow the will of the Devil himself and slay your nemesis in an epic quest that will take you on a journey in the Boredom Kingdom, a mythical realm shattered by the Curse. You will meet friends along the way, from a haughty Owl to a snarky Crow!<br/><br/>Pumpkin Jack is a Spooky Scary 3D platformer</span>","Oct 27, 2021"
Action Adventure|Survival|,79,Remedy Entertainment,7.9,T,Epic Games,Alan Wake Remastered,"In this cinematic action-thriller, troubled author Alan Wake embarks on a desperate search for his missing wife, Alice. Following her mysterious disappearance from the Pacific Northwest town of Bright Falls, he discovers pages of a horror story he has supposedly written, but he has no memory of. Wake is soon forced to question his sanity, as page by page, the story comes true before his eyes: a hostile presence of supernatural darkness is taking over everyone it finds, turning them against him. He has no choice but to confront the forces of darkness armed only with his flashlight, a handgun and what remains of his shredded mind. His nightmarish journey to find answers to the mind-bending mystery he faces will lead him into the terrifying depths of the night. Alan Wake Remastered offers the complete experience, with the main game and its two story expansions - The Signal and The Writer - in stunning new 4K visuals. The tense, episodic story is packed with unexpected twists, heart-stopping cliff hangers, and intense bursts of combat where it takes more than bullets to banish the darkness. The game’s cutscenes, quirky cast of characters, and the majestic Pacific Northwest vistas have been enhanced for an experience that delivers as much on its visual impact as its unnerving atmosphere.","Oct  5, 2021"
